{"number": 1, "chunk_path": "_/Allan_H_chunks_4000.json:chunk_1", "question": "Which of the following is a recommendation for medical practitioners regarding new drug therapies?", "options": {"A": "Always prescribe based on personal experience alone.", "B": "Consult the product information sheet for the latest dosage and contraindications.", "C": "Use the same recommendations for all patients regardless of condition.", "D": "Rely solely on outdated medical literature.", "E": "Disregard changes in treatment protocols established by recent studies."}, "answer": "B", "chain_of_thought": "To solve the question, we need to evaluate the options in relation to best practices for medical practitioners when it comes to prescribing new drug therapies.\n\n1. **Option A: Always prescribe based on personal experience alone.**\n   - This is not advisable as personal experience may not reflect the latest evidence or the safety and efficacy of the drug for all patients.\n\n2. **Option B: Consult the product information sheet for the latest dosage and contraindications.**\n   - This is a good practice as product information sheets are regularly updated with the latest information about the drug, including dosage and contraindications, ensuring safe and effective prescribing.\n\n3. **Option C: Use the same recommendations for all patients regardless of condition.**\n   - This option is incorrect because treatment should always be tailored to the individual patient's condition, needs, and circumstances.\n\n4. **Option D: Rely solely on outdated medical literature.**\n   - This is not recommended as relying on outdated information can lead to unsafe practices and ineffective treatments.\n\n5. **Option E: Disregard changes in treatment protocols established by recent studies.**\n   - This is also incorrect since recent studies often provide vital updates that can improve patient care and outcomes.\n\nAfter evaluating these options, Option B stands out as the best recommendation for medical practitioners regarding new drug therapies. It emphasizes the importance of using reliable and current information when prescribing medication.\n\nSo, the answer is (B) Consult the product information sheet for the latest dosage and contraindications."}
{"number": 2, "chunk_path": "_/Allan_H_chunks_4000.json:chunk_2", "question": "Which of the following conditions is characterized by a decline in cognitive function and memory loss, potentially leading to the need for assistance in daily living activities?", "options": {"A": "Delirium ", "B": "Dementia ", "C": "Epilepsy ", "D": "Stroke ", "E": "Parkinson's Disease "}, "answer": "B", "chain_of_thought": "To solve the question, we need to analyze the provided options and relate them to the characteristics described in the question. \n\nThe question refers to a condition characterized by:\n\n1. Decline in cognitive function\n2. Memory loss\n3. Potential need for assistance in daily living activities\n\nNow, let's evaluate each option:\n\nA) Delirium: This is an acute, often reversible condition that involves confusion and changes in awareness, but it is not primarily characterized by a decline in cognitive function or memory loss in the chronic sense.\n\nB) Dementia: This condition is characterized by a progressive decline in cognitive function, including memory loss, and often leads to difficulties in performing daily living activities. It fits the description perfectly.\n\nC) Epilepsy: This is a neurological disorder characterized by recurrent seizures. It does not primarily involve cognitive decline or memory loss, although some people with epilepsy may experience cognitive issues.\n\nD) Stroke: A stroke can lead to sudden cognitive impairment and memory issues depending on the area of the brain affected. However, it is not a chronic condition characterized by a progressive decline like dementia.\n\nE) Parkinson's Disease: This is primarily a movement disorder, but it can also lead to cognitive decline in the later stages. However, it is not primarily defined by cognitive decline and memory loss.\n\nBased on the analysis, the condition that best matches the description provided in the question is dementia.\n\nSo, the answer is (B) Dementia."}
{"number": 3, "chunk_path": "_/Allan_H_chunks_4000.json:chunk_3", "question": "Which of the following conditions is primarily associated with disturbances of consciousness?", "options": {"A": "Chronic depression", "B": "Vascular dementia", "C": "Coma and related disorders", "D": "Alcohol-related disorders", "E": "Fatigue and anxiety disorders"}, "answer": "C", "chain_of_thought": "To determine which condition is primarily associated with disturbances of consciousness, let's analyze each option:\n\nA) Chronic depression - While depression can affect a person's awareness or concentration, it does not primarily cause disturbances in consciousness.\n\nB) Vascular dementia - This condition involves cognitive decline due to blood flow problems in the brain, but it is more related to memory and thinking issues rather than direct disturbances in consciousness.\n\nC) Coma and related disorders - Coma is a state of profound unconsciousness, and related disorders involve varying degrees of impaired consciousness. This is directly related to disturbances in consciousness.\n\nD) Alcohol-related disorders - These can affect consciousness, especially in cases of intoxication or withdrawal, but they do not primarily define disturbances of consciousness as a condition.\n\nE) Fatigue and anxiety disorders - These can affect mental state and alertness but are not primarily associated with disturbances of consciousness.\n\nFrom this analysis, option C) Coma and related disorders is the most directly associated with disturbances of consciousness, as these conditions specifically involve altered states of awareness.\n\nSo, the answer is (C) Coma and related disorders."}
{"number": 4, "chunk_path": "_/Allan_H_chunks_4000.json:chunk_4", "question": "Considering the principles of neurology, what is essential for achieving a comprehensive understanding of neurologic diseases?", "options": {"A": "Relying solely on algorithmic diagnosis methods", "B": "Focusing only on patient history without physical examination", "C": "Understanding both clinical and new scientific data", "D": "Emphasizing the historical context over current medical practices", "E": "Avoiding details in favor of summary descriptions"}, "answer": "C", "chain_of_thought": "To tackle this question, we need to assess what is essential for a comprehensive understanding of neurologic diseases based on principles of neurology. \n\n1. **Option A** suggests relying solely on algorithmic diagnosis methods. While algorithms can aid in diagnosis, they cannot replace the need for a comprehensive understanding that includes clinical judgment and understanding of the underlying pathophysiology.\n\n2. **Option B** focuses on patient history without physical examination. This approach is incomplete because a thorough understanding of neurologic diseases requires both a detailed patient history and a physical examination to gather all relevant information.\n\n3. **Option C** emphasizes understanding both clinical and new scientific data. This is crucial in neurology as it combines established clinical practices with the latest research and advancements, which can lead to better diagnosis and treatment options.\n\n4. **Option D** highlights the importance of historical context over current practices. While historical context can be informative, it should not take precedence over current evidence-based practices, which are essential for effective patient care.\n\n5. **Option E** advocates avoiding details in favor of summary descriptions. This approach is not conducive to a comprehensive understanding, as details are often critical in diagnosing and managing neurologic diseases.\n\nBased on this analysis, the most appropriate option is C, as it encapsulates the need for a multidimensional understanding that includes both clinical experience and the latest scientific research.\n\nSo, the answer is (C) Understanding both clinical and new scientific data."}
{"number": 5, "chunk_path": "_/Allan_H_chunks_4000.json:chunk_5", "question": "Which aspect of neurology does the textbook emphasize for understanding clinical practice and enhancing scholarship?", "options": {"A": "relying solely on historical cases ", "B": "the integration of scientific discoveries into a clinical context ", "C": "the exclusion of psychiatric syndromes from consideration ", "D": "focusing on specialty-specific diseases only ", "E": "the formulaic arrangement of diseases "}, "answer": "B", "chain_of_thought": "To solve this question, we need to analyze the provided options in relation to the aspect of neurology that could enhance clinical practice and scholarship as emphasized by a textbook.\n\n1. **Option A** states \"relying solely on historical cases.\" This suggests a focus only on past cases, which may not help in understanding current clinical practices or advancements.\n\n2. **Option B** proposes \"the integration of scientific discoveries into a clinical context.\" This implies that applying new scientific findings to clinical practice is crucial for understanding neurology and improving patient care.\n\n3. **Option C** mentions \"the exclusion of psychiatric syndromes from consideration.\" Excluding relevant syndromes would likely hinder a comprehensive understanding of neurology.\n\n4. **Option D** discusses \"focusing on specialty-specific diseases only.\" This narrow focus may limit the broader understanding necessary for effective clinical practice.\n\n5. **Option E** indicates \"the formulaic arrangement of diseases.\" A rigid formulaic approach may not enhance understanding or scholarship effectively.\n\nBased on this analysis, Option B stands out as the most beneficial for bridging the gap between theoretical knowledge and practical application in neurology. Integrating scientific discoveries into clinical settings is essential for improving both understanding and scholarship.\n\nSo, the answer is (B) the integration of scientific discoveries into a clinical context."}
{"number": 6, "chunk_path": "_/Allan_H_chunks_4000.json:chunk_6", "question": "Which of the following classifications is considered less effective in categorizing diseases of the nervous system?", "options": {"A": "Classification based on specific neurologic disorders", "B": "Classification according to vascular, traumatic, and degenerative mechanisms", "C": "Classification based on parts of the nervous system such as cerebrum and spinal cord", "D": "Classification related to obstetric disorders and emergency neurology", "E": "Classification according to age periods"}, "answer": "D", "chain_of_thought": "To answer the question about the classifications of diseases of the nervous system, we need to analyze each option provided and assess their effectiveness in categorizing neurological disorders.\n\nA) **Classification based on specific neurologic disorders** - This method is effective as it directly groups diseases by their specific characteristics and symptoms.\n\nB) **Classification according to vascular, traumatic, and degenerative mechanisms** - This classification is also effective as it categorizes diseases based on their underlying mechanisms, which is crucial for understanding and treatment.\n\nC) **Classification based on parts of the nervous system such as cerebrum and spinal cord** - While this method helps in understanding the location of the disease, it may not always provide insight into the disease's nature or etiology, making it less comprehensive.\n\nD) **Classification related to obstetric disorders and emergency neurology** - This classification is quite specific and may not encompass a wide variety of neurologic disorders, thus making it less effective in a general context.\n\nE) **Classification according to age periods** - This classification can provide useful information regarding the prevalence of certain disorders in different ages but does not categorize diseases based on their pathophysiology or symptoms.\n\nNow, comparing these classifications, option D appears to be the least effective for a broader perspective on neurological diseases, as it focuses on very specific scenarios rather than a comprehensive categorization of various neurologic disorders.\n\nSo, the answer is (D) Classification related to obstetric disorders and emergency neurology."}
{"number": 7, "chunk_path": "_/Allan_H_chunks_4000.json:chunk_7", "question": "What is the first step in the clinical method of neurology when approaching a patient with neurologic disease?", "options": {"A": "Interpreting relevant symptoms and signs in terms of physiology and anatomy", "B": "Conducting a lumbar puncture", "C": "Securing the symptoms and signs by history and physical examination", "D": "Formulating a syndromic diagnosis", "E": "Localizing the disease process"}, "answer": "C", "chain_of_thought": "To approach the question about the first step in the clinical method of neurology when dealing with a patient with neurologic disease, we need to analyze the available options.\n\n1. **Interpreting relevant symptoms and signs in terms of physiology and anatomy (A)**: This step involves understanding what the symptoms and signs mean based on neurological concepts, but it typically comes after gathering information.\n\n2. **Conducting a lumbar puncture (B)**: A lumbar puncture is a specific diagnostic procedure that is generally performed after an initial assessment has been completed to gather more information.\n\n3. **Securing the symptoms and signs by history and physical examination (C)**: This option emphasizes the importance of obtaining a detailed medical history and conducting a physical examination. This is a foundational step in diagnosing any condition, including neurologic diseases.\n\n4. **Formulating a syndromic diagnosis (D)**: This step involves categorizing the symptoms into a specific syndrome, which requires prior knowledge of the patient's history and examination findings.\n\n5. **Localizing the disease process (E)**: This involves determining where in the nervous system the disease is occurring, which is also dependent on having gathered sufficient initial data from the history and examination.\n\nGiven the options, the most logical first step in the clinical method of neurology is to secure the symptoms and signs through a thorough history and physical examination. This step is crucial as it lays the groundwork for further investigation and diagnosis.\n\nSo, the answer is (C) Securing the"}
{"number": 8, "chunk_path": "_/Allan_H_chunks_4000.json:chunk_8", "question": "What is the primary purpose of anatomic diagnosis in the context of neurological disease assessment?", "options": {"A": "To identify nonneurologic organ system involvement", "B": "To localize the disease process within the nervous system", "C": "To deduce the pathologic diagnosis", "D": "To assess the degree of disability", "E": "To formulate a syndromic diagnosis"}, "answer": "B", "chain_of_thought": "To solve the question, we need to understand the primary purpose of anatomic diagnosis specifically in the context of neurological disease assessment. \n\n1. **Anatomic Diagnosis**: This refers to the process of identifying the specific area or structure in the nervous system that is affected by a disease.\n2. **Neurological Disease Assessment**: Involves evaluating disorders that impact the nervous system, which can include conditions affecting the brain, spinal cord, and peripheral nerves.\n\nNow, let's analyze the options:\n\nA) **To identify nonneurologic organ system involvement**: This option does not align with the purpose of anatomic diagnosis, which focuses on the nervous system.\n\nB) **To localize the disease process within the nervous system**: This option directly relates to anatomic diagnosis, as it involves determining the specific location of the problem within the nervous system.\n\nC) **To deduce the pathologic diagnosis**: While anatomic diagnosis may contribute to understanding pathology, the primary aim is localization rather than deducing pathology itself.\n\nD) **To assess the degree of disability**: This option pertains more to the functional impact of a disease rather than its anatomical localization.\n\nE) **To formulate a syndromic diagnosis**: While syndromic diagnosis involves grouping signs and symptoms, it is not the main aim of anatomic diagnosis.\n\nAfter analyzing all options, it becomes clear that the primary purpose of anatomic diagnosis in the context of neurological disease assessment is to localize the disease process within the So, the answer is (B)."}
{"number": 10, "chunk_path": "_/Allan_H_chunks_4000.json:chunk_10", "question": "A 65-year-old woman presents to the clinic with difficulty writing, calculating, and confusion regarding left and right. She is unable to identify individual fingers on her left hand. Which neurologic syndrome do these symptoms most likely represent?", "options": {"A": "Wernicke\u2019s aphasia", "B": "Gerstmann syndrome", "C": "Balint syndrome", "D": "Hemispatial neglect", "E": "Dementia with Lewy bodies"}, "answer": "B", "chain_of_thought": "To solve the question, we must analyze the symptoms presented by the 65-year-old woman:\n\n1. **Difficulty writing**: This symptom suggests issues with fine motor skills or cognitive functions related to language and writing, known as \"agraphia.\"\n  \n2. **Calculating difficulties**: This indicates problems with numerical understanding or arithmetic, known as \"acalculia.\"\n\n3. **Confusion regarding left and right**: This suggests a disorientation in spatial awareness, particularly in distinguishing between the left and right sides of the body.\n\n4. **Inability to identify individual fingers on her left hand**: This symptom points towards a condition called \"finger agnosia,\" which is the inability to recognize or identify one's own fingers.\n\nNow, looking at these symptoms collectively, they align well with a specific neurologic syndrome. \n\n- **Wernicke\u2019s aphasia** (Option A) primarily involves language comprehension issues, which does not directly correlate with the symptoms presented.\n  \n- **Gerstmann syndrome** (Option B) is characterized by a combination of agraphia, acalculia, finger agnosia, and left-right disorientation. The patient\u2019s symptoms are consistent with all four components of Gerstmann syndrome.\n  \n- **Balint syndrome** (Option C) involves difficulties in visual attention and spatial awareness but does not include the specific symptoms described here.\n  \n- **Hemispatial neglect** (Option D) refers to the neglect of one side of space, So, the answer is (B)."}
{"number": 11, "chunk_path": "_/Allan_H_chunks_4000.json:chunk_11", "question": "A 50-year-old woman presents with a history of visual disturbances that include blurred vision and occasional floaters. She mentions that these symptoms have been worsening over the past month. During the neurological examination, she reports feeling 'off balance' and occasionally feels like the room is spinning. What is the most likely underlying condition causing these sensory symptoms?", "options": {"A": "Multiple sclerosis", "B": "Migraine", "C": "Vestibular neuritis", "D": "Alzheimer disease", "E": "Parkinson disease"}, "answer": "A", "chain_of_thought": "To analyze the question, we have a 50-year-old woman experiencing several sensory disturbances: blurred vision, floaters, a feeling of being 'off balance', and episodes where she feels like the room is spinning. \n\n1. **Visual disturbances**: Blurred vision and floaters can be associated with various conditions, including retinal issues or neurological conditions.\n2. **Balance issues**: Feeling 'off balance' and experiencing sensations of spinning (vertigo) suggest a vestibular or neurological problem.\n3. **Age**: At 50 years old, certain conditions like multiple sclerosis (MS) can be a concern, especially since it often presents with visual symptoms and balance issues.\n\nNow, let's evaluate the options:\n\nA) **Multiple sclerosis**: MS can cause visual disturbances (like optic neuritis), balance problems, and sensory symptoms. It is a strong contender given her age and symptoms.\n\nB) **Migraine**: Migraines can cause visual disturbances (aura) and vertigo, but they typically come with headache and are less likely to cause prolonged symptoms without the headache component.\n\nC) **Vestibular neuritis**: This condition can cause vertigo and balance issues, but it typically does not present with visual disturbances like blurred vision or floaters.\n\nD) **Alzheimer disease**: Alzheimer's primarily affects memory and cognitive function and is less likely to cause the specific sensory symptoms described.\n\nE) **Parkinson disease**: Parkinson's can cause balance issues and visual disturbances So, the answer is (A)."}
{"number": 12, "chunk_path": "_/Allan_H_chunks_4000.json:chunk_12", "question": "A 70-year-old woman is brought to the clinic by her husband, who reports that she has been experiencing confusion, memory loss, and difficulty expressing her thoughts. During the consultation, the physician observes that she is rambling and has inconsistent responses regarding her symptoms. What should the physician do to assess her condition accurately?", "options": {"A": "Immediately refer her for neuropsychological evaluation", "B": "Obtain the history of the illness from her husband", "C": "Prescribe cognitive-enhancing medication", "D": "Reassure the family that this is a normal part of aging", "E": "Conduct a series of imaging studies"}, "answer": "B", "chain_of_thought": "To solve the question, we need to analyze the situation presented. The patient is a 70-year-old woman experiencing confusion, memory loss, and difficulty in expressing her thoughts. Her husband provides the history, indicating that her symptoms are significant enough to bring her to a clinic. The physician observes that she is rambling and giving inconsistent responses, which suggests that her cognitive function is compromised.\n\nNow, let's evaluate the options:\n\nA) **Immediately refer her for neuropsychological evaluation** - This might be a reasonable step, but it is often premature without first gathering more information about her condition.\n\nB) **Obtain the history of the illness from her husband** - This option allows the physician to gather crucial information about the onset, duration, and progression of the symptoms, which is essential for a proper assessment.\n\nC) **Prescribe cognitive-enhancing medication** - Prescribing medication without a thorough assessment and understanding of her condition would be inappropriate.\n\nD) **Reassure the family that this is a normal part of aging** - While some cognitive decline can be normal with aging, the significant symptoms described warrant further investigation rather than reassurance.\n\nE) **Conduct a series of imaging studies** - Imaging studies can be useful, but they should be guided by a clearer understanding of the patient\u2019s condition based on history and examination.\n\nIn this case, the most appropriate initial step for the physician would be to obtain a comprehensive history from her husband. This will provide the necessary context and details required to assess her So, the answer is (B)."}
{"number": 13, "chunk_path": "_/Allan_H_chunks_4000.json:chunk_13", "question": "In a neurologic examination, what is the ideal sequence for a thorough assessment to avoid omissions?", "options": {"A": "Cranial nerves, sensory functions, motor functions, autonomic nervous system, gait observation", "B": "Motor functions, gait observation, sensory functions, cranial nerves, autonomic nervous system", "C": "Cranial nerves, motor functions, gait observation, sensory functions, autonomic nervous system", "D": "Sensory functions, motor functions, cranial nerves, autonomic nervous system, gait observation", "E": "Motor functions, cranial nerves, autonomic nervous system, sensory functions, gait observation"}, "answer": "C", "chain_of_thought": "To determine the ideal sequence for a thorough neurologic examination, we need to consider how neurologic assessments are typically structured. A systematic approach is crucial to ensure that no areas are overlooked.\n\n1. **Cranial Nerves**: These are assessed first because they include vital functions such as vision, hearing, facial movement, and swallowing. Evaluating cranial nerves can also provide insights into brainstem function.\n\n2. **Motor Functions**: After cranial nerves, it is important to evaluate motor functions to assess strength, coordination, and any signs of atrophy or involuntary movements. This can help identify issues in the central or peripheral nervous systems.\n\n3. **Sensory Functions**: Next, sensory functions should be examined, including light touch, pain, temperature, and proprioception. This helps in assessing the integrity of sensory pathways.\n\n4. **Autonomic Nervous System**: Following sensory functions, testing for autonomic nervous system function is key for evaluating responses such as heart rate, blood pressure, and sweating.\n\n5. **Gait Observation**: Finally, observing gait is important as it provides insights into overall coordination and balance, which can reflect the functioning of multiple neurologic systems.\n\nNow, let's analyze the options provided:\n\nA) Cranial nerves, sensory functions, motor functions, autonomic nervous system, gait observation - This sequence is not ideal as it places sensory functions before motor functions.\n\nB) Motor functions, gait observation, sensory functions, cranial nerves, autonomic So, the answer is (C)."}
{"number": 14, "chunk_path": "_/Allan_H_chunks_4000.json:chunk_14", "question": "Which of the following tests is most useful for evaluating higher cortical functions in a patient suspected of having a neurological disorder?", "options": {"A": "Repetition of a series of digits in reverse order", "B": "Measuring blood pressure", "C": "Electromyography (EMG)", "D": "Urinalysis", "E": "Chest X-ray"}, "answer": "A", "chain_of_thought": "To evaluate higher cortical functions in a patient suspected of having a neurological disorder, we need to focus on tests that assess cognitive abilities, memory, language, and executive functions. \n\nLet's analyze the options:\n- A) Repetition of a series of digits in reverse order: This test is commonly used in neuropsychological assessments to evaluate working memory and attention, which are aspects of higher cortical functions.\n- B) Measuring blood pressure: This is a physiological test and does not assess cognitive functions.\n- C) Electromyography (EMG): This test evaluates muscle and nerve function but does not provide information about higher cortical functions.\n- D) Urinalysis: This test is used to assess kidney function and detect various diseases but has no relevance to cognitive or neurological evaluation.\n- E) Chest X-ray: This imaging test is used to assess lung and heart conditions, not neurological functions.\n\nAmong these options, the only test that directly evaluates aspects of higher cortical functions is option A.\n\nSo, the answer is (A) Repetition of a series of digits in reverse order."}
{"number": 15, "chunk_path": "_/Allan_H_chunks_4000.json:chunk_15", "question": "A 68-year-old man presents with difficulty using his right hand, particularly with tasks requiring fine motor skills like buttoning his shirt. He also has noticeable atrophy in the right hand muscles. Which of the following aspects of the neurologic examination would be most informative to assess the potential underlying cause?", "options": {"A": "Observation of facial movements while speaking", "B": "Testing the strength of leg muscles in bed", "C": "Assessment of muscle tone and coordination in the right hand", "D": "Evaluating the auditory function using a tuning fork", "E": "Measuring visual fields by confrontation testing"}, "answer": "C", "chain_of_thought": "To solve this question, we need to analyze the symptoms presented by the 68-year-old man. He has difficulty using his right hand, especially with fine motor skills, and he shows noticeable atrophy in the muscles of the right hand. \n\nThese findings suggest a possible neurological issue that affects the motor function of the right hand. The atrophy indicates that the muscles are not being activated properly, which may be due to a problem with the motor pathways that innervate the hand.\n\nNow, let's evaluate the options provided:\n\nA) **Observation of facial movements while speaking**: This could assess cranial nerve function but is not directly related to the motor function of the hand.\n\nB) **Testing the strength of leg muscles in bed**: This assesses lower limb function, which is not relevant to the current symptoms focused on the right hand.\n\nC) **Assessment of muscle tone and coordination in the right hand**: This is directly relevant to the symptoms presented. It would provide information on the motor function and neurological integrity of the right hand, which is where the patient is experiencing difficulties.\n\nD) **Evaluating the auditory function using a tuning fork**: This is unrelated to the motor function of the hand.\n\nE) **Measuring visual fields by confrontation testing**: This is related to vision and would not provide relevant information regarding the motor function of the hand.\n\nGiven the patient\u2019s symptoms of difficulty with fine motor skills and muscle atrophy in the right hand, the most informative aspect of the So, the answer is (C)."}
{"number": 17, "chunk_path": "_/Allan_H_chunks_4000.json:chunk_17", "question": "Which of the following tests is included in a brief neurologic examination to assess balance and coordination?", "options": {"A": "Finger to nose test", "B": "Visual acuity test", "C": "Vibration sensibility test", "D": "Examination of the pupils", "E": "Evaluation of respiratory function"}, "answer": "A", "chain_of_thought": "To determine which test is included in a brief neurologic examination to assess balance and coordination, we need to evaluate each of the provided options:\n\nA) **Finger to nose test**: This test assesses coordination and can help evaluate cerebellar function. The patient is asked to touch their nose with their finger, which requires balance and precise motor control.\n\nB) **Visual acuity test**: This test checks how well a person can see but does not assess balance or coordination.\n\nC) **Vibration sensibility test**: This test evaluates the sense of vibration but is not specific for balance or coordination.\n\nD) **Examination of the pupils**: This test assesses the response of the pupils to light and does not directly relate to balance or coordination.\n\nE) **Evaluation of respiratory function**: This is focused on the respiratory system and does not assess balance or coordination.\n\nAmong the options, the **finger to nose test** is explicitly designed to assess balance and coordination, making it the correct choice.\n\nSo, the answer is (A) Finger to nose test."}
{"number": 18, "chunk_path": "_/Allan_H_chunks_4000.json:chunk_18", "question": "A 65-year-old man presents to the clinic with no overt neurological symptoms but complaints of dizziness when standing. Upon examination, the physician notes absent Achilles reflexes and diminished vibratory sensation in the feet. What condition might this patient be at risk for based on these findings?", "options": {"A": "Multiple sclerosis ", "B": "Diabetic neuropathy ", "C": "Cerebral infarction ", "D": "Parkinson's disease ", "E": "Amyotrophic lateral sclerosis "}, "answer": "B", "chain_of_thought": "To approach this question, let's summarize the key information provided:\n\n1. **Patient's Age and Symptoms**: The patient is a 65-year-old man with dizziness when standing. This suggests a possible issue with balance or blood pressure regulation upon standing (orthostatic hypotension).\n\n2. **Examination Findings**:\n   - **Absent Achilles Reflexes**: This indicates a possible issue with the lower motor neurons or peripheral nerves.\n   - **Diminished Vibratory Sensation in the Feet**: This suggests peripheral neuropathy, which can affect the sensory nerves responsible for transmitting vibrations.\n\n3. **Analyzing Options**:\n   - **A) Multiple sclerosis**: This condition usually presents with a variety of neurological symptoms, including vision problems, motor weakness, and sensory disturbances. While it could cause some similar symptoms, the patient's age and specific findings suggest otherwise.\n   - **B) Diabetic neuropathy**: This condition commonly causes peripheral neuropathy characterized by decreased reflexes and diminished sensation in the feet, especially in older adults with diabetes. Given the sensory deficits and absent reflexes, diabetic neuropathy is a strong contender.\n   - **C) Cerebral infarction**: This would typically present with focal neurological deficits, and the patient has no overt neurological symptoms.\n   - **D) Parkinson's disease**: This primarily affects motor function and typically does not cause absent reflexes or diminished vibratory sensation in the feet.\n   - **E) Amyotrophic lateral sclerosis So, the answer is (B)."}
{"number": 19, "chunk_path": "_/Allan_H_chunks_4000.json:chunk_19", "question": "Which of the following findings during a general medical examination may indicate an underlying systemic disease affecting the nervous system?", "options": {"A": "Presence of hallucinations ", "B": "Adenopathy or lung infiltrate ", "C": "Defective memory ", "D": "Unconsciousness ", "E": "Altered muscle tone "}, "answer": "B", "chain_of_thought": "To determine which of the findings during a general medical examination may indicate an underlying systemic disease affecting the nervous system, let's analyze each option:\n\nA) **Presence of hallucinations**: Hallucinations can be associated with various neurological and psychiatric disorders, including delirium, schizophrenia, or neurological diseases like Parkinson's disease. This can suggest a systemic impact on the nervous system.\n\nB) **Adenopathy or lung infiltrate**: These findings are more indicative of infectious or hematological conditions rather than directly pointing to a nervous system issue.\n\nC) **Defective memory**: Memory deficits can indicate neurological disorders such as dementia or encephalopathy, suggesting an underlying systemic disease affecting the nervous system.\n\nD) **Unconsciousness**: This is a severe condition that can indicate significant neurological impairment or systemic problems affecting consciousness, such as metabolic disturbances, head trauma, or other acute CNS issues.\n\nE) **Altered muscle tone**: Changes in muscle tone can be indicative of neurological disorders, such as dystonia, spasticity, or other conditions affecting the motor pathways in the nervous system.\n\nNow, considering the options that directly indicate a systemic disease affecting the nervous system, options A, C, D, and E are all relevant. However, the most profound indications would be unconsciousness (D), which indicates a severe underlying issue affecting the nervous system.\n\nSo, the most suitable option that indicates a systemic disease affecting the nervous system is:\n\nSo, the answer is (D) Uncon"}
{"number": 20, "chunk_path": "_/Allan_H_chunks_4000.json:chunk_20", "question": "A 58-year-old man presents to the clinic for a routine check-up. He has a family history of hypertension and stroke. During the visit, he mentions occasional headaches and states he occasionally feels dizzy. Upon examination, the physician finds carotid bruits and hears a heart murmur. What important diagnostic step should the physician consider given this patient's risk factors and symptoms?", "options": {"A": "Order an MRI of the brain to assess for infarction.", "B": "Refer the patient for a carotid ultrasound to evaluate for stenosis.", "C": "Initiate a low-dose aspirin regimen for primary prevention.", "D": "Prescribe antihypertensive medication immediately.", "E": "Schedule a follow-up visit in 6 months for monitoring."}, "answer": "B", "chain_of_thought": "To solve this question, we need to analyze the relevant information provided about the patient and his symptoms.\n\n1. **Patient Profile**: The patient is a 58-year-old man with a family history of hypertension and stroke. He reports occasional headaches and dizziness.\n  \n2. **Physical Examination Findings**: The physician finds carotid bruits (which may indicate turbulent blood flow, possibly due to stenosis) and hears a heart murmur.\n\n3. **Risk Factors**: The combination of his age, family history, symptoms (headaches and dizziness), and physical exam findings (carotid bruits and heart murmur) raises concern for potential cardiovascular issues, including carotid artery disease, which could lead to stroke.\n\nGiven these considerations, the physician should focus on identifying any significant carotid artery stenosis, as this could be a major contributing factor to the patient's symptoms (headaches and dizziness) and could increase his risk of stroke.\n\nNow let's evaluate the options:\n\nA) **Order an MRI of the brain to assess for infarction** - While this could be useful if there were clear signs of a stroke, the immediate concern is evaluating the carotid arteries given the bruits and symptoms.\n\nB) **Refer the patient for a carotid ultrasound to evaluate for stenosis** - This directly addresses the concern of carotid artery disease, which is a likely cause of his symptoms and risk factors.\n\nC) **Initiate a low-dose aspirin regimen for primary prevention** - While this So, the answer is (B)."}
{"number": 21, "chunk_path": "_/Allan_H_chunks_4000.json:chunk_21", "question": "A 30-year-old man presents with neurological symptoms including tremors and difficulty with coordination. He has no significant past medical history, and there are no clear diagnostic findings from his clinical examination. What should the neurologist consider in addition to the clinical method to potentially identify the underlying neurologic disease?", "options": {"A": "Genetic testing and biochemical screening", "B": "Immediate MRI of the brain", "C": "Prescribing empirical treatment", "D": "Referral for psychiatric evaluation", "E": "Observing the patient for several months without intervention"}, "answer": "A", "chain_of_thought": "To solve this question, we need to analyze the case presented and the available options carefully. \n\nThe patient is a 30-year-old man with neurological symptoms such as tremors and coordination difficulties. Since he has no significant past medical history and the clinical examination doesn't provide clear diagnostic findings, the neurologist needs to consider additional methods to identify the underlying neurological disease.\n\nLet's break down the options:\n\nA) **Genetic testing and biochemical screening** - This option is valuable because many neurological disorders can have genetic and biochemical components. Testing can help identify conditions like Wilson's disease, metabolic disorders, or hereditary syndromes.\n\nB) **Immediate MRI of the brain** - While an MRI can be useful in visualizing structural abnormalities in the brain, the absence of significant findings on clinical examination makes it less likely that an immediate MRI will provide the answers needed without further context or specific indications.\n\nC) **Prescribing empirical treatment** - This approach does not help in identifying the underlying condition. Instead, it may mask symptoms and delay proper diagnosis.\n\nD) **Referral for psychiatric evaluation** - Although psychiatric evaluation can be relevant in cases where psychological factors play a role, the primary symptoms are neurological, and the need is to identify a neurological cause rather than a psychological one.\n\nE) **Observing the patient for several months without intervention** - This option is not ideal as it does not actively seek to identify or treat a potential underlying condition that could be causing the symptoms.\n\nConsidering the necessity to explore the underlying cause of So, the answer is (A)."}
{"number": 22, "chunk_path": "_/Allan_H_chunks_4000.json:chunk_22", "question": "In the evaluation of neurological diseases, why is it essential to obtain tissue for examination whenever reasonable and safe?", "options": {"A": "It enhances the reliability of statistical analyses.", "B": "It provides certainty of histopathology to the clinical study.", "C": "It allows for immediate treatment decisions.", "D": "It eliminates the need for clinical observation.", "E": "It decreases the cost of diagnostic procedures."}, "answer": "B", "chain_of_thought": "To evaluate the importance of obtaining tissue for examination in the context of neurological diseases, we need to consider the role of histopathology in diagnosis. \n\n1. Tissue samples provide direct insight into the cellular and structural characteristics of a disease process. This can help to confirm or rule out specific conditions that may not be evident through imaging or clinical evaluation alone.\n\n2. The presence or absence of certain histological features can be pivotal in establishing a definitive diagnosis. This certainty can guide treatment options and management strategies effectively.\n\n3. While obtaining tissue may not always lead to immediate treatment decisions (as seen in option C), the certainty it provides through histopathological examination is crucial for accurate diagnosis.\n\n4. Other options do not align with the primary reason for obtaining tissue. For instance, option A is more about statistical analysis, option D misrepresents the necessity of clinical observation, and option E does not focus on the diagnostic certainty that tissue examination provides.\n\nThus, the most compelling reason for obtaining tissue samples in the evaluation of neurological diseases is that it provides certainty of histopathology to the clinical study.\n\nSo, the answer is (B) It provides certainty of histopathology to the clinical study."}
{"number": 23, "chunk_path": "_/Allan_H_chunks_4000.json:chunk_23", "question": "Which of the following approaches is essential in the diagnosis of neurological diseases?", "options": {"A": "Relying solely on imaging studies ", "B": "Utilizing a careful history and examination ", "C": "Administering aggressive therapy before diagnosis ", "D": "Waiting for spontaneous recovery before evaluation ", "E": "Focusing exclusively on laboratory test results "}, "answer": "B", "chain_of_thought": "To address the question of which approach is essential in the diagnosis of neurological diseases, we need to evaluate the given options based on standard medical practices.\n\n1. **Relying solely on imaging studies (Option A)**: While imaging studies (like MRI or CT scans) are important in diagnosing neurological conditions, they should not be the only approach, as they often need to be interpreted alongside clinical findings.\n\n2. **Utilizing a careful history and examination (Option B)**: This option emphasizes the significance of obtaining a thorough patient history and conducting a physical examination. This is crucial as it helps identify symptoms, onset, progression, and other key factors that inform diagnosis.\n\n3. **Administering aggressive therapy before diagnosis (Option C)**: This approach is typically not recommended, as initiating treatment without a clear diagnosis can lead to mismanagement of the patient's condition.\n\n4. **Waiting for spontaneous recovery before evaluation (Option D)**: This is not advisable either, as it can delay necessary interventions and may not provide the best outcomes for the patient.\n\n5. **Focusing exclusively on laboratory test results (Option E)**: Similar to imaging studies, laboratory tests are helpful but should not be the sole focus. They need to be part of a broader diagnostic approach.\n\nConsidering these points, the most effective and essential approach in diagnosing neurological diseases involves a combination of clinical history and examination, which is best represented by Option B.\n\nSo, the answer is (B) Utilizing a careful history and examination."}
{"number": 24, "chunk_path": "_/Allan_H_chunks_4000.json:chunk_24", "question": "What is the primary purpose of performing a lumbar puncture in the context of neurological disease diagnosis?", "options": {"A": "To obtain pressure measurements and procure a sample of the cerebrospinal fluid for examination", "B": "To perform a full body MRI scan", "C": "To provide spinal anesthesia for surgical procedures", "D": "To administer medication directly into the bloodstream", "E": "To evaluate the electrical activity of the brain"}, "answer": "A", "chain_of_thought": "To solve this question, we need to understand the primary purpose of a lumbar puncture in the context of diagnosing neurological diseases. \n\nA lumbar puncture, also known as a spinal tap, involves inserting a needle into the lower back to access the cerebrospinal fluid (CSF) surrounding the spinal cord. The main objectives of this procedure include:\n\n1. **Pressure Measurements**: It allows for the assessment of intracranial pressure.\n2. **CSF Sample Collection**: It provides a sample of cerebrospinal fluid, which can be analyzed for various conditions, such as infections (e.g., meningitis), bleeding, and other neurological disorders.\n\nNow, let\u2019s evaluate the options provided:\n\nA) To obtain pressure measurements and procure a sample of the cerebrospinal fluid for examination - This option accurately describes the primary purpose of a lumbar puncture.\n\nB) To perform a full body MRI scan - This is unrelated to a lumbar puncture.\n\nC) To provide spinal anesthesia for surgical procedures - While lumbar puncture can be used for anesthesia, this is not its primary purpose in diagnosing neurological diseases.\n\nD) To administer medication directly into the bloodstream - Lumbar punctures do not involve intravenous administration of medication.\n\nE) To evaluate the electrical activity of the brain - This is usually done through an EEG, not a lumbar puncture.\n\nBased on the evaluation, option A best captures the primary purpose of performing a lumbar puncture in the context of neurological disease diagnosis.\n\nSo, the answer So, the answer is (A)."}
{"number": 25, "chunk_path": "_/Allan_H_chunks_4000.json:chunk_25", "question": "What is a characteristic CSF finding in bacterial infections?", "options": {"A": "WBC count of less than 10/mm3", "B": "Protein level of 50-200 mg%", "C": "WBC count greater than 50/mm3, often greatly increased", "D": "Normal glucose level", "E": "Increased glucose level relative to blood"}, "answer": "C", "chain_of_thought": "To determine the characteristic cerebrospinal fluid (CSF) finding in bacterial infections, let's analyze the provided options based on our knowledge of CSF analysis in various types of meningitis.\n\n1. **WBC count of less than 10/mm3 (Option A)**: This finding is typically associated with normal CSF or viral infections, not bacterial infections.\n\n2. **Protein level of 50-200 mg% (Option B)**: While protein levels can be elevated in bacterial meningitis, this range is not specific enough to indicate a bacterial infection.\n\n3. **WBC count greater than 50/mm3, often greatly increased (Option C)**: In bacterial meningitis, the WBC count is usually significantly elevated, often exceeding 100/mm3, and is predominantly composed of neutrophils. This option aligns with the expected CSF findings in bacterial infections.\n\n4. **Normal glucose level (Option D)**: In bacterial meningitis, glucose levels in the CSF are typically low, not normal.\n\n5. **Increased glucose level relative to blood (Option E)**: This is not typical of bacterial infections; in fact, bacterial meningitis usually presents with decreased glucose levels.\n\nBased on this analysis, the characteristic finding in the CSF during a bacterial infection is a significantly elevated WBC count. \n\nTherefore, the correct answer is (C) WBC count greater than 50/mm3, often greatly increased. \n\nSo, the answer is (C) WBC"}
{"number": 26, "chunk_path": "_/Allan_H_chunks_4000.json:chunk_26", "question": "A 35-year-old man presents for evaluation due to recurrent headaches and occasional nausea. A lumbar puncture is performed to obtain cerebrospinal fluid (CSF) for analysis. During the procedure, the physician uses a small gauge needle and positions the patient on his side in a fetal position. After the procedure, the patient develops a headache that persists for several days. What is the most common complication associated with lumbar puncture?", "options": {"A": "infection", "B": "cerebral herniation", "C": "headache", "D": "nerve root injury", "E": "subarachnoid hemorrhage"}, "answer": "C", "chain_of_thought": "To analyze the question, we first summarize the key details:\n\n- A 35-year-old man has recurrent headaches and occasional nausea.\n- A lumbar puncture (LP) is performed using a small gauge needle while the patient is in a fetal position.\n- After the procedure, the patient develops a headache that lasts several days.\n\nNow, we need to identify the most common complication associated with lumbar puncture.\n\n1. **Infection**: While this is a possible complication, it is relatively rare compared to other complications that can occur immediately after the procedure.\n   \n2. **Cerebral herniation**: This is a serious complication that can occur if there is increased intracranial pressure, but it is not the most common complication associated with lumbar puncture.\n\n3. **Headache**: Post-lumbar puncture headache is a well-known complication. It often occurs due to a leakage of cerebrospinal fluid (CSF) at the puncture site, leading to decreased CSF pressure and resulting in a headache.\n\n4. **Nerve root injury**: This is a potential complication but is less common than post-lumbar puncture headaches.\n\n5. **Subarachnoid hemorrhage**: This is a rare complication and is not the most common issue associated with lumbar puncture procedures.\n\nGiven that the patient developed a headache after the lumbar puncture, it aligns with the common knowledge that post-lumbar puncture headache (often referred to as spinal headache) So, the answer is (C)."}
{"number": 27, "chunk_path": "_/Allan_H_chunks_4000.json:chunk_27", "question": "What is the normal opening pressure range for cerebrospinal fluid (CSF) in an adult during a lumbar puncture?", "options": {"A": "30 to 60 mmH2O", "B": "100 to 180 mmH2O", "C": "200 to 300 mmH2O", "D": "50 to 70 mmH2O", "E": "8 to 14 mmHg"}, "answer": "B", "chain_of_thought": "To determine the normal opening pressure range for cerebrospinal fluid (CSF) in adults during a lumbar puncture, we need to review the typical values found in clinical practice.\n\n1. **Understanding CSF Opening Pressure**: The opening pressure measured during a lumbar puncture is an important diagnostic tool. It can indicate potential issues such as increased intracranial pressure.\n\n2. **Normal Ranges**: The normal range for CSF opening pressure in adults is typically cited in millimeters of water (mmH2O). The expected normal range is generally considered to be between 70 to 180 mmH2O.\n\n3. **Examining the Options**:\n   - A) 30 to 60 mmH2O: This range is too low for normal adult CSF opening pressures.\n   - B) 100 to 180 mmH2O: This range falls within the commonly accepted normal range.\n   - C) 200 to 300 mmH2O: This range is too high and suggests elevated intracranial pressure.\n   - D) 50 to 70 mmH2O: This range is also too low for normal adult CSF pressures.\n   - E) 8 to 14 mmHg: This range converts to approximately 200 to 350 mmH2O, which is also too high.\n\n4. **Conclusion**: Based on the evaluation of the options and the standard clinical reference values, option B (100 to 180 So, the answer is (B)."}
{"number": 29, "chunk_path": "_/Allan_H_chunks_4000.json:chunk_29", "question": "A 58-year-old male presents to the emergency department with sudden onset headache and a stiff neck. A lumbar puncture is performed, and the cerebrospinal fluid (CSF) appears hazy with a pink-red discoloration. The clinician suspects a possible subarachnoid hemorrhage. Based on the CSF findings, which characteristic change would you expect to see over the next few days?", "options": {"A": "Oxyhemoglobin levels increasing and then decreasing after several days ", "B": "Increased white blood cells due to phagocytosis of red blood cells ", "C": "Clear CSF after 48 hours ", "D": "Presence of fibrinous webs in the CSF ", "E": "Decreased bilirubin levels after 3 days "}, "answer": "A", "chain_of_thought": "To solve the question, we need to analyze the clinical presentation and the findings from the lumbar puncture. The patient has a sudden onset headache and a stiff neck, which are classic symptoms of possible meningitis or subarachnoid hemorrhage (SAH). The CSF findings show hazy appearance with pink-red discoloration, strongly suggesting the presence of blood, which aligns with SAH.\n\nIn cases of SAH, the CSF undergoes several changes over time:\n\n1. **Initial Findings**: The initial CSF may appear xanthochromic (yellowish) or bloody.\n2. **Oxyhemoglobin**: In the early stages, the oxyhemoglobin from the lysed red blood cells will be present, which may initially increase and then decrease as the blood breaks down.\n3. **White Blood Cells**: Over the next few days, there is typically an inflammatory response, leading to an increase in white blood cells due to phagocytosis of the red blood cells by macrophages.\n4. **Clarity of CSF**: The CSF is likely to remain hazy or turbid due to the presence of cells and protein; it will not clear within 48 hours.\n5. **Fibrinous Webs**: In cases with more significant bleeding, fibrinous webs can develop over time, but this is not an immediate change.\n6. **Bilirubin Levels**: After a few days, bilirubin levels may increase So, the answer is (A)."}
{"number": 30, "chunk_path": "_/Allan_H_chunks_4000.json:chunk_30", "question": "A 45-year-old man presents to the emergency department with sudden onset of a severe headache, photophobia, and neck stiffness. A lumbar puncture reveals xanthochromia in the cerebrospinal fluid (CSF). What does this finding most likely indicate regarding the timing of the hemorrhage?", "options": {"A": "The hemorrhage occurred within the last 2 hours", "B": "The hemorrhage occurred 2 to 3 days ago", "C": "The hemorrhage occurred 1 to 2 weeks ago", "D": "The hemorrhage occurred over a month ago", "E": "The hemorrhage type cannot be determined from xanthochromia alone"}, "answer": "B", "chain_of_thought": "To solve this question, we need to analyze the symptoms presented by the patient and the significance of the lumbar puncture findings. \n\n1. **Patient Presentation**: The 45-year-old man has sudden onset of a severe headache, photophobia (sensitivity to light), and neck stiffness. These symptoms are characteristic of meningeal irritation, which often points to a potential bleeding event, such as a subarachnoid hemorrhage (SAH).\n\n2. **Lumbar Puncture Findings**: The presence of xanthochromia in the cerebrospinal fluid (CSF) is a significant finding. Xanthochromia refers to a yellowish discoloration of the CSF, which is due to the breakdown of hemoglobin from red blood cells. This process takes time after a hemorrhage occurs.\n\n3. **Timing of Hemorrhage**: \n   - Xanthochromia typically develops 2 to 12 hours after a hemorrhage, and it may persist for up to several weeks.\n   - If the hemorrhage occurred within the last 2 hours, the CSF would not show xanthochromia.\n   - If the hemorrhage occurred 2 to 3 days ago, it is quite likely that xanthochromia would be present, as it takes time for the hemoglobin to break down.\n   - If the hemorrhage occurred 1 to 2 weeks ago, it would still show xanthochromia, but So, the answer is (B)."}
{"number": 32, "chunk_path": "_/Allan_H_chunks_4000.json:chunk_32", "question": "What is a characteristic finding in the cerebrospinal fluid (CSF) analysis of a patient with multiple sclerosis?", "options": {"A": "Normal protein levels with no oligoclonal bands", "B": "Elevated IgG levels exceeding 12% of total CSF protein", "C": "Protein levels consistently above 500 mg/dL", "D": "Presence of fibrinogen and IgM", "E": "Low levels of albumin"}, "answer": "B", "chain_of_thought": "To solve the question, we need to recall the key characteristics of cerebrospinal fluid (CSF) analysis in multiple sclerosis (MS). \n\n1. **Normal CSF findings**: In MS, the CSF is usually not normal. Therefore, option A, which states \"Normal protein levels with no oligoclonal bands,\" is unlikely to be correct.\n\n2. **Elevated IgG levels**: MS is known for the presence of oligoclonal bands in the CSF, which indicates increased IgG synthesis. While option B mentions elevated IgG levels, it specifically states \"exceeding 12% of total CSF protein,\" which is not a standard way to describe the findings in MS. The presence of oligoclonal bands is the hallmark rather than just elevated IgG levels.\n\n3. **High protein levels**: Option C states that \"protein levels consistently above 500 mg/dL\" is characteristic of MS. However, in MS, protein levels can be elevated but typically do not reach such high levels. That would be more indicative of other conditions.\n\n4. **Fibrinogen and IgM**: Option D mentions the presence of fibrinogen and IgM. While IgM can be present in various conditions, it's not a notable feature of MS.\n\n5. **Low albumin levels**: Option E states \"Low levels of albumin.\" In typical cases of MS, albumin levels are not low, and the albumin So, the answer is (B)."}
{"number": 33, "chunk_path": "_/Allan_H_chunks_4000.json:chunk_33", "question": "A 30-year-old man presents with fever, headache, and neck stiffness. A lumbar puncture reveals a CSF glucose level of 25 mg/dL and pleocytosis. Which condition is most likely given these findings?", "options": {"A": "Viral meningitis", "B": "Bacterial meningitis", "C": "Tuberculous meningitis", "D": "Fungal meningitis", "E": "Neurosyphilis"}, "answer": "B", "chain_of_thought": "To solve the question, let's summarize the key points of the case presented:\n\n- The patient is a 30-year-old man with symptoms of fever, headache, and neck stiffness, which are indicative of meningitis.\n- A lumbar puncture (spinal tap) was performed, and the results showed:\n  - CSF glucose level: 25 mg/dL (which is low, as normal levels are typically around 45-75 mg/dL).\n  - Pleocytosis: This refers to an increased number of white blood cells in the cerebrospinal fluid (CSF), suggesting an inflammatory process.\n\nNow, let's analyze the options based on the CSF findings:\n\nA) **Viral meningitis** - Typically, viral meningitis presents with normal glucose levels in the CSF, so this option is unlikely given the low glucose level.\n\nB) **Bacterial meningitis** - This condition usually presents with low glucose levels in the CSF (much lower than normal), elevated white blood cell count with a predominance of neutrophils, and is often characterized by fever, headache, and neck stiffness.\n\nC) **Tuberculous meningitis** - This presents with significantly low glucose levels in the CSF, pleocytosis, often with lymphocytic predominance, and can also be associated with chronic symptoms.\n\nD) **Fungal meningitis** - Similar to tuberculous meningitis, it can present with low glucose levels and lymphocytic predominance in the So, the answer is (B)."}
{"number": 34, "chunk_path": "_/Allan_H_chunks_4000.json:chunk_34", "question": "A 30-year-old man presents with fever, headache, and altered mental status. CSF analysis shows a normal glucose level and positive cryptococcal antigen test. What is the most likely infectious agent?", "options": {"A": "Treponema pallidum", "B": "Crytococcus neoformans", "C": "Herpes simplex virus", "D": "Cytomegalovirus", "E": "Mycobacterium tuberculosis"}, "answer": "B", "chain_of_thought": "To solve this question, we need to analyze the clinical presentation and the results from the cerebrospinal fluid (CSF) analysis.\n\n1. **Clinical Presentation**: The patient is a 30-year-old man with symptoms of fever, headache, and altered mental status. These symptoms are suggestive of meningitis or an infectious process affecting the central nervous system.\n\n2. **CSF Analysis**: The CSF shows a normal glucose level and a positive cryptococcal antigen test. Normal glucose levels in the CSF, alongside altered mental status and fever, can help narrow down the potential infectious agents.\n\n3. **Differential Diagnosis**:\n   - **Treponema pallidum**: This bacterium causes syphilis and typically does not lead to a positive cryptococcal antigen test or present with these CSF findings.\n   - **Cryptococcus neoformans**: This is a fungal agent that is known to cause cryptococcal meningitis, especially in immunocompromised individuals. The positive cryptococcal antigen test strongly indicates this infection.\n   - **Herpes simplex virus**: This can cause viral meningitis but would typically show a low glucose level in the CSF and would not usually yield a positive cryptococcal antigen test.\n   - **Cytomegalovirus**: Similar to herpes virus, it can cause encephalitis but is less associated with a positive cryptococcal antigen test and normal glucose levels.\n   - **Mycobacterium So, the answer is (B)."}
{"number": 35, "chunk_path": "_/Allan_H_chunks_4000.json:chunk_35", "question": "Which of the following statements about cerebrospinal fluid (CSF) analysis in bacterial meningitis is true?", "options": {"A": "CSF levels of lactic dehydrogenase are elevated in bacterial meningitis.", "B": "CSF concentrations of sodium, potassium, calcium, and magnesium are altered in bacterial meningitis.", "C": "CSF chloride levels are elevated in bacterial meningitis.", "D": "The pH of CSF is typically higher than the pH of arterial blood in bacterial meningitis.", "E": "The ammonia content in CSF is higher than in serum in cases of bacterial meningitis."}, "answer": "A", "chain_of_thought": "To answer the question on cerebrospinal fluid (CSF) analysis in bacterial meningitis, we need to evaluate each statement in the context of what is known about the changes in CSF during bacterial infections.\n\nA) CSF levels of lactic dehydrogenase are elevated in bacterial meningitis.  \n- In bacterial meningitis, inflammation and cellular breakdown can lead to increased levels of certain enzymes, including lactic dehydrogenase (LDH), in the CSF.\n\nB) CSF concentrations of sodium, potassium, calcium, and magnesium are altered in bacterial meningitis.  \n- While there can be some changes in electrolyte levels, significant alterations in these specific ions are not a hallmark of bacterial meningitis.\n\nC) CSF chloride levels are elevated in bacterial meningitis.  \n- Generally, chloride levels do not significantly increase in bacterial meningitis; they might remain normal or show variable changes.\n\nD) The pH of CSF is typically higher than the pH of arterial blood in bacterial meningitis.  \n- In bacterial meningitis, the pH of CSF often decreases rather than increases, as the infection can lead to lactic acidosis.\n\nE) The ammonia content in CSF is higher than in serum in cases of bacterial meningitis.  \n- While some conditions can elevate ammonia in CSF, it is not a characteristic finding specifically associated with bacterial meningitis.\n\nAfter analyzing these options, the most accurate statement regarding CSF analysis in bacterial meningitis is option A So, the answer is (A)."}
{"number": 36, "chunk_path": "_/Allan_H_chunks_4000.json:chunk_36", "question": "In patients with idiopathic and drug-induced parkinsonism, which of the following metabolites in cerebrospinal fluid (CSF) is most likely to be reduced?", "options": {"A": "5-hydroxyindoleacetic acid (5-HIAA) ", "B": "Homovanillic acid (HVA) ", "C": "Catecholamines ", "D": "Lipid concentrations ", "E": "Neuropeptides "}, "answer": "B", "chain_of_thought": "To solve the question, we need to analyze the information provided regarding idiopathic and drug-induced parkinsonism. Parkinsonism is characterized by a deficiency of dopamine in the brain, which affects various neurotransmitter systems, including the metabolism of dopamine itself.\n\n1. **Understanding Metabolites**: The options given include various metabolites and substances in the cerebrospinal fluid (CSF):\n   - **5-Hydroxyindoleacetic acid (5-HIAA)**: A metabolite of serotonin.\n   - **Homovanillic acid (HVA)**: A major metabolite of dopamine.\n   - **Catecholamines**: Includes dopamine, norepinephrine, and epinephrine.\n   - **Lipid concentrations**: Refers to the levels of lipids in CSF.\n   - **Neuropeptides**: These are small protein-like molecules used by neurons to communicate.\n\n2. **Parkinsonism and Dopamine**: In parkinsonism, particularly in idiopathic Parkinson's disease and drug-induced forms, there is a significant reduction in dopamine levels. Consequently, the metabolite levels associated with dopamine metabolism would also be affected.\n\n3. **Focus on HVA**: Since HVA is a direct metabolite of dopamine, it is expected that in conditions where there is reduced dopamine (such as in parkinsonism), the levels of HVA would also be reduced. \n\n4. **Comparing Other Options**:\n   - **5-HIAA** would be So, the answer is (B)."}
{"number": 38, "chunk_path": "_/Allan_H_chunks_4000.json:chunk_38", "question": "A 45-year-old male patient presents with severe back pain and neurological symptoms including weakness in the lower limbs. Imaging studies reveal bony spurs encroaching on spinal nerve roots. What imaging technique is most appropriate for diagnosing spinal conditions in this scenario?", "options": {"A": "X-ray", "B": "CT myelography", "C": "Ultrasound", "D": "MRI", "E": "Bone scan"}, "answer": "D", "chain_of_thought": "To address the question, we have a 45-year-old male patient with severe back pain and neurological symptoms, particularly weakness in the lower limbs. Imaging studies have shown bony spurs that are encroaching on spinal nerve roots. \n\nNow, let's evaluate the imaging options provided:\n\nA) **X-ray**: While X-rays can show bony spurs and general alignment of the spine, they do not provide detailed information about soft tissues, nerve roots, or the spinal canal.\n\nB) **CT myelography**: This technique combines CT imaging with a contrast medium injected into the spinal canal. It is effective for visualizing spinal structures and can show nerve root impingement, but it is more invasive and typically reserved for cases where MRI is not available or feasible.\n\nC) **Ultrasound**: This imaging technique is not commonly used for visualizing spinal conditions or deep structures like the spinal cord and nerve roots.\n\nD) **MRI**: Magnetic Resonance Imaging is the gold standard for evaluating soft tissue structures, including the spinal cord, nerve roots, and intervertebral discs. MRI can effectively show the degree of compression on nerve roots caused by bony spurs and other soft tissue abnormalities.\n\nE) **Bone scan**: This is primarily used to detect metabolic bone disease or inflammation but does not provide detailed images of soft tissues or the spinal canal.\n\nGiven the patient's symptoms and the need for detailed imaging of the spinal nerve roots and surrounding structures, the most appropriate imaging So, the answer is (D)."}
{"number": 39, "chunk_path": "_/Allan_H_chunks_4000.json:chunk_39", "question": "In MRI imaging, which of the following contrasts is highlighted in T2-weighted images, making them particularly useful for evaluating specific conditions?", "options": {"A": "Demyelination and edema ", "B": "Bone fractures ", "C": "Fatty tissue ", "D": "Calcium deposits ", "E": "Brain tumors "}, "answer": "A", "chain_of_thought": "To solve this question, we need to understand how T2-weighted MRI images work. In MRI imaging, different tissue contrasts are highlighted depending on the type of weighting used.\n\n1. **T2-weighted images**: In T2-weighted MRI, fluids and edema appear bright. This is because T2-weighted imaging is sensitive to the presence of water in tissues. Therefore, conditions that involve increased fluid content, such as edema, will be more visible.\n\n2. **Conditions evaluated with T2-weighted images**: Since T2-weighted images highlight water content, they are particularly useful for evaluating conditions such as demyelination (which can lead to edema), tumors (which often have necrotic areas that may contain fluid), and any other processes that increase water content in tissues.\n\n3. **Options Analysis**:\n   - A) Demyelination and edema: Both of these conditions involve increased water content, making them highly visible on T2-weighted images.\n   - B) Bone fractures: These are better visualized on T1-weighted images or through other imaging modalities like X-rays.\n   - C) Fatty tissue: Fatty tissues appear bright on T1-weighted images, not T2-weighted.\n   - D) Calcium deposits: These are not well visualized on T2-weighted images.\n   - E) Brain tumors: While certain aspects of brain tumors can be seen on T2-weighted images, the focus here is on the So, the answer is (A)."}
{"number": 40, "chunk_path": "_/Allan_H_chunks_4000.json:chunk_40", "question": "What is a major contraindication to the use of MRI in patients?", "options": {"A": "Presence of a cardiac pacemaker", "B": "History of epilepsy", "C": "Elevated blood pressure", "D": "Pregnancy in the first trimester", "E": "Allergy to gadolinium"}, "answer": "A", "chain_of_thought": "To determine the major contraindication for MRI use, we need to evaluate each of the provided options:\n\nA) **Presence of a cardiac pacemaker**: This is a significant concern because the magnetic fields used in MRI can interfere with the operation of a pacemaker, potentially causing malfunction or displacement.\n\nB) **History of epilepsy**: While patients with epilepsy can have MRIs, they may require precautions or monitoring during the procedure, but it's not a strict contraindication.\n\nC) **Elevated blood pressure**: Elevated blood pressure is not a contraindication to MRI. It may require monitoring but does not prevent the use of MRI altogether.\n\nD) **Pregnancy in the first trimester**: While caution is advised when performing MRIs on pregnant women, particularly in the first trimester, it is not an outright contraindication.\n\nE) **Allergy to gadolinium**: Gadolinium is a contrast agent used in some MRIs, and while an allergy to gadolinium is important to consider, it does not prevent the use of MRI without contrast.\n\nAfter evaluating all options, the presence of a cardiac pacemaker stands out as a major contraindication due to the potential danger involved.\n\nSo, the answer is (A) Presence of a cardiac pacemaker."}
{"number": 41, "chunk_path": "_/Allan_H_chunks_4000.json:chunk_41", "question": "In pregnant patients, what is the primary consideration for performing MRI during the first trimester?", "options": {"A": "It is completely contraindicated for any reason", "B": "It may be performed if medically indicated", "C": "It can only be done if the patient is in her second trimester", "D": "MRI should always be avoided unless under emergency circumstances", "E": "MRI can be performed without any restrictions"}, "answer": "B", "chain_of_thought": "To address the question regarding the use of MRI in pregnant patients during the first trimester, we need to consider the safety and medical guidelines surrounding MRI imaging in this specific population.\n\n1. **Understanding MRI Safety**: MRI (Magnetic Resonance Imaging) uses strong magnetic fields and radio waves to create images of organs and tissues. It does not involve ionizing radiation, which is a significant concern during pregnancy.\n\n2. **First Trimester Considerations**: The first trimester is a critical period for fetal development, and while MRI is generally considered to be safe, there are certain precautions and considerations to take into account.\n\n3. **Medical Indication**: If there is a strong medical reason to perform an MRI (e.g., if the benefits to the mother and fetus outweigh the risks), it may be performed. This is especially true for conditions that require urgent diagnosis and management.\n\n4. **Guidance on MRI Use**: Medical guidelines typically suggest that while MRI is not completely contraindicated during pregnancy, it should be used judiciously and only when necessary.\n\nNow let's evaluate the options given:\n\nA) It is completely contraindicated for any reason - This is not accurate, as MRI can be performed if necessary.\n\nB) It may be performed if medically indicated - This option aligns with medical guidelines, as it emphasizes the need for a medical reason.\n\nC) It can only be done if the patient is in her second trimester - This is incorrect, as MRI can be done in the first trimester So, the answer is (B)."}
{"number": 42, "chunk_path": "_/Allan_H_chunks_4000.json:chunk_42", "question": "A 55-year-old man presents with sudden onset of weakness in his right arm and slurred speech. An MRI of the brain is performed, which shows a bright white signal in the area of cerebral infarction. Which imaging technique helped in differentiating the nature of this lesion?", "options": {"A": "CT angiography", "B": "Diffusion-weighted imaging (DWI)", "C": "Functional MRI (fMRI)", "D": "T1-weighted MRI", "E": "MR spectroscopy"}, "answer": "B", "chain_of_thought": "To solve the question, let's summarize the relevant information:\n\n1. The patient is a 55-year-old man with sudden onset weakness in his right arm and slurred speech, indicating a potential stroke or cerebral event.\n2. An MRI of the brain shows a bright white signal in the area of cerebral infarction, which suggests a recent ischemic stroke.\n3. The question asks about the imaging technique that helped differentiate the nature of this lesion.\n\nNow, let's analyze the options provided:\n\nA) CT angiography - This primarily visualizes blood vessels and can show blockages or abnormalities but does not directly assess the nature of brain lesions.\n\nB) Diffusion-weighted imaging (DWI) - This is a type of MRI that is particularly sensitive in detecting acute ischemic strokes. It can differentiate between viable brain tissue and areas that are infarcted, showing bright signals in areas of acute infarction.\n\nC) Functional MRI (fMRI) - This measures brain activity by detecting changes associated with blood flow. It is not typically used for differentiating lesions.\n\nD) T1-weighted MRI - While useful for different types of tissue characterization, it is not the best choice for detecting the acute changes seen in ischemic strokes.\n\nE) MR spectroscopy - This technique provides metabolic information but is not typically used for diagnosing or differentiating acute infarctions.\n\nGiven this analysis, the best answer is B) Diffusion-weighted imaging (DWI), as it specifically helps in identifying the nature of ischemic So, the answer is (B)."}
{"number": 44, "chunk_path": "_/Allan_H_chunks_4000.json:chunk_44", "question": "Which noninvasive technique can reliably detect intracranial vascular lesions and extracranial carotid artery stenosis?", "options": {"A": "Positron Emission Tomography (PET)", "B": "Computed Tomography Angiography (CTA)", "C": "Magnetic Resonance Angiography (MRA)", "D": "Single-Photon Emission Computed Tomography (SPECT)", "E": "Ultrasound Doppler Imaging"}, "answer": "C", "chain_of_thought": "To solve this question, we need to identify which noninvasive imaging technique is best suited for detecting intracranial vascular lesions and assessing the status of the extracranial carotid artery.\n\n1. **Understanding the Techniques**:\n   - **Positron Emission Tomography (PET)**: Primarily used for metabolic imaging and not specifically for vascular lesions.\n   - **Computed Tomography Angiography (CTA)**: A good method for visualizing vascular structures but involves some radiation exposure.\n   - **Magnetic Resonance Angiography (MRA)**: A noninvasive technique that uses magnetic resonance imaging to visualize blood vessels without radiation, making it suitable for intracranial and extracranial assessments.\n   - **Single-Photon Emission Computed Tomography (SPECT)**: Generally used for functional imaging rather than vascular structures.\n   - **Ultrasound Doppler Imaging**: Noninvasive and effective for evaluating blood flow in arteries, particularly the carotid arteries.\n\n2. **Comparing the Options**:\n   - **MRA** is well known for its ability to visualize vascular anatomy and detect lesions in the brain as well as assessing carotid artery stenosis. It is particularly useful because it doesn't involve ionizing radiation.\n   - **CTA** is also effective, but it involves radiation, which may not be preferred for all patients.\n   - **Ultrasound Doppler Imaging** is great for extracranial carotid artery assessment but may not So, the answer is (C)."}
{"number": 46, "chunk_path": "_/Allan_H_chunks_4000.json:chunk_46", "question": "Which diagnostic technique is primarily used to detect and estimate the degree of stenosis in the internal carotid artery?", "options": {"A": "Electroencephalography (EEG)", "B": "Transcranial Doppler ultrasound", "C": "Echocardiography", "D": "Magnetic Resonance Imaging (MRI)", "E": "Computed Tomography (CT)"}, "answer": "B", "chain_of_thought": "To determine which diagnostic technique is primarily used to detect and estimate the degree of stenosis in the internal carotid artery, we need to analyze the options provided:\n\nA) **Electroencephalography (EEG)**: This technique is used to measure electrical activity in the brain. It is not relevant for assessing blood vessels or stenosis.\n\nB) **Transcranial Doppler ultrasound**: This is a type of ultrasound that measures blood flow in the brain and can be used to assess blood flow velocities in the internal carotid artery. It is helpful in detecting stenosis but is not the primary method used for estimating the degree of stenosis.\n\nC) **Echocardiography**: This is primarily used to visualize heart structures and assess cardiac function. It is not typically used for carotid artery assessment.\n\nD) **Magnetic Resonance Imaging (MRI)**: MRI can be used to visualize blood vessels, including the carotid arteries, but it is not the most common first-line test specifically for estimating stenosis.\n\nE) **Computed Tomography (CT)**: CT angiography is commonly used for detailed imaging of blood vessels and can effectively assess the degree of stenosis in the internal carotid artery.\n\nAmong these options, the most relevant technique for detecting and estimating stenosis in the internal carotid artery is CT angiography, which is part of the CT options.\n\nSo, the answer is (E) Computed Tomography (CT)."}
{"number": 48, "chunk_path": "_/Allan_H_chunks_4000.json:chunk_48", "question": "Which EEG wave patterns are indicative of a normal waking adult?", "options": {"A": "Delta waves (1-3 Hz) only", "B": "Beta waves (10-20 mV) predominantly in the frontal regions", "C": "Alpha waves (8-12 Hz) in both occipital and parietal regions", "D": "Theta waves (4-7 Hz) exclusively in temporal regions", "E": "None of the above"}, "answer": "C", "chain_of_thought": "To answer the question regarding which EEG wave patterns are indicative of a normal waking adult, we need to understand the different types of brain waves and their typical associations:\n\n1. **Delta Waves (1-3 Hz)**: These are slow brain waves and are typically seen during deep sleep, not in a waking adult.\n\n2. **Beta Waves (10-20 Hz)**: These waves are associated with active thinking, concentration, and are predominantly seen in the frontal regions when a person is awake and alert. However, the option states \"10-20 mV,\" which is incorrect since beta waves are typically measured in frequency (Hz), not amplitude (mV).\n\n3. **Alpha Waves (8-12 Hz)**: These waves are prominent when a person is awake but relaxed, especially when their eyes are closed. They are most commonly seen in the occipital and parietal regions.\n\n4. **Theta Waves (4-7 Hz)**: These waves are typically associated with light sleep or relaxation and are not predominantly seen in a normal waking adult.\n\n5. **None of the above**: This option would apply if all other options were incorrect.\n\nNow, examining the options closely, the most representative EEG pattern for a normal waking adult is the presence of alpha waves. Therefore, the best choice from the given options is:\n\n## Answer: After analyzing the EEG wave patterns associated with a normal waking adult, alpha waves (8-12 Hz) are indicative of such a state, particularly So, the answer is (C)."}
{"number": 49, "chunk_path": "_/Allan_H_chunks_4000.json:chunk_49", "question": "A 24-year-old male presents to the emergency department after a seizure episode. He has a history of alcohol use and has recently stopped drinking. An EEG shows photoparoxysmal responses with abnormal spike and slow-wave activity after stroboscopic stimulation. What is the most likely diagnosis for this patient?", "options": {"A": "Alcohol withdrawal seizures", "B": "Hysteria-induced seizures", "C": "Benign epilepsy of childhood", "D": "Generalized tonic-clonic seizures", "E": "Central nervous system infection"}, "answer": "A", "chain_of_thought": "To solve this question, we need to analyze the patient's history and the EEG findings. \n\n1. **Patient Background**: The patient is a 24-year-old male with a history of alcohol use who has recently stopped drinking. This is crucial because alcohol withdrawal can lead to seizures, particularly if the cessation is abrupt.\n\n2. **Seizure Episode**: The patient presented after experiencing a seizure episode. The timing, following cessation of alcohol, suggests a potential link to withdrawal.\n\n3. **EEG Findings**: The EEG shows photoparoxysmal responses with abnormal spike and slow-wave activity after stroboscopic stimulation. Photoparoxysmal responses are often seen in patients with epilepsy, particularly generalized epilepsy syndromes.\n\n4. **Differential Diagnosis**:\n   - **A) Alcohol withdrawal seizures**: This is a strong possibility given the patient's recent cessation of alcohol. Withdrawal seizures typically happen within 6-48 hours after the last drink.\n   - **B) Hysteria-induced seizures**: These are psychological and would not typically show abnormal spike and slow-wave activity on an EEG.\n   - **C) Benign epilepsy of childhood**: This usually presents in childhood, not in a 24-year-old.\n   - **D) Generalized tonic-clonic seizures**: While these can occur, the context of alcohol withdrawal makes this less likely as a primary diagnosis without other seizure types being present.\n   - **E) Central nervous system infection**: So, the answer is (A)."}
{"number": 50, "chunk_path": "_/Allan_H_chunks_4000.json:chunk_50", "question": "Which of the following EEG findings is most characteristic of Creutzfeldt-Jakob disease?", "options": {"A": "Triphasic waves", "B": "Spike-and-wave complexes appearing at 3 Hz", "C": "Grossly disorganized background activity interrupted by pseudoperiodic discharges", "D": "Electrocerebral silence", "E": "Slow waves about 2 per second"}, "answer": "C", "chain_of_thought": "Creutzfeldt-Jakob disease (CJD) is a rapidly progressive neurodegenerative disorder associated with prion infection. One of the key characteristics of CJD on an electroencephalogram (EEG) is the presence of specific abnormal waveforms.\n\n1. **Triphasic waves (Option A)**: These are typically seen in metabolic encephalopathies, such as hepatic encephalopathy, and are not specific to CJD.\n\n2. **Spike-and-wave complexes appearing at 3 Hz (Option B)**: This pattern is more commonly associated with generalized epilepsy, particularly absence seizures, rather than CJD.\n\n3. **Grossly disorganized background activity interrupted by pseudoperiodic discharges (Option C)**: This option describes the chaotic and irregular EEG patterns observed in CJD. The pseudoperiodic discharges are a hallmark of the disease and indicate cortical dysfunction.\n\n4. **Electrocerebral silence (Option D)**: This refers to a complete lack of electrical activity and is not characteristic of CJD, as there is usually some background activity.\n\n5. **Slow waves about 2 per second (Option E)**: While slow waves can be seen in various conditions, they do not specifically characterize CJD.\n\nBased on this analysis, the EEG finding that is most characteristic of Creutzfeldt-Jakob disease is the grossly disorganized background activity with pseudoperiodic discharges.\n\nSo, the answer is (C) Grossly dis"}
{"number": 51, "chunk_path": "_/Allan_H_chunks_4000.json:chunk_51", "question": "A 25-year-old woman with a known history of epilepsy presents to the emergency department after having a generalized tonic-clonic seizure. An EEG is performed, and the results show 3-per-second spike-and-wave complexes. What does this finding indicate?", "options": {"A": "Absence seizures", "B": "Electrocerebral silence", "C": "Generalized epilepsy", "D": "Pseudoseizures", "E": "Deep temporal lobe seizure"}, "answer": "A", "chain_of_thought": "To solve this question, we first need to analyze the information provided:\n\n1. **Patient Profile**: A 25-year-old woman with a history of epilepsy.\n2. **Presentation**: She has experienced a generalized tonic-clonic seizure.\n3. **EEG Findings**: The EEG shows 3-per-second spike-and-wave complexes.\n\nNow, let's break down the EEG findings:\n\n- **3-per-second spike-and-wave complexes** are characteristic of absence seizures. These are typically seen in patients with generalized epilepsy syndromes, particularly in those who experience absence seizures.\n- Generalized tonic-clonic seizures represent a different seizure type and do not specifically correlate with the presence of 3-per-second spike-and-wave complexes on an EEG.\n- Electrocerebral silence would show no electrical activity, which is not the case here.\n- Pseudoseizures are typically non-epileptic seizures and would not show these specific EEG findings.\n- Deep temporal lobe seizures would not typically present with 3-per-second spike-and-wave complexes; they would have different patterns.\n\nGiven this information, the most appropriate interpretation of the EEG findings is that they indicate absence seizures, which fall under the umbrella of generalized epilepsy.\n\nSo, the answer is (A) Absence seizures."}
{"number": 52, "chunk_path": "_/Allan_H_chunks_4000.json:chunk_52", "question": "What EEG pattern is characteristic of herpes simplex encephalitis?", "options": {"A": "Periodic high-voltage sharp waves and slow-wave complexes in the temporal regions", "B": "Bilateral synchronous slow waves with no sharp activity", "C": "Cortical spikes in all lobes", "D": "Generalized spike-wave discharges", "E": "Normal EEG with no abnormalities"}, "answer": "A", "chain_of_thought": "To solve the question about the characteristic EEG pattern of herpes simplex encephalitis, we start by analyzing the available options.\n\n1. **Understanding Herpes Simplex Encephalitis**: This condition is typically associated with inflammation of the temporal lobes of the brain, often resulting from a viral infection, specifically the herpes simplex virus.\n\n2. **EEG Patterns**: In terms of EEG findings, herpes simplex encephalitis is known to show specific abnormalities. These include:\n   - High-voltage sharp waves\n   - Slow-wave complexes predominantly located in the temporal regions.\n\n3. **Evaluating Each Option**:\n   - **A)** Periodic high-voltage sharp waves and slow-wave complexes in the temporal regions: This aligns well with the known EEG findings in herpes simplex encephalitis.\n   - **B)** Bilateral synchronous slow waves with no sharp activity: This is less specific and not characteristic of herpes simplex encephalitis.\n   - **C)** Cortical spikes in all lobes: This is more generalized and not specific to herpes simplex encephalitis.\n   - **D)** Generalized spike-wave discharges: This is typically seen in generalized epilepsies, not in herpes simplex encephalitis.\n   - **E)** Normal EEG with no abnormalities: This does not correlate at all with the condition, as herpes simplex encephalitis usually shows EEG changes.\n\n4. **Conclusion**: Based on the characteristic EEG findings of herpes simplex encephalitis, option A So, the answer is (A)."}
{"number": 54, "chunk_path": "_/Allan_H_chunks_4000.json:chunk_54", "question": "Which of the following EEG findings is characteristic of hepatic coma?", "options": {"A": "Bilateral synchronous delta waves", "B": "Sharp triphasic waves", "C": "Generalized slowing with focal asymmetry", "D": "Normal EEG recording", "E": "Periodic bursts of high-amplitude sharp waves"}, "answer": "B", "chain_of_thought": "To solve the question regarding the EEG findings characteristic of hepatic coma, we need to review what hepatic coma (also known as hepatic encephalopathy) is and how it affects brain activity as measured by an electroencephalogram (EEG).\n\nHepatic coma is a severe complication of liver disease, where the liver fails to remove toxins from the bloodstream, leading to neurological symptoms. The most common EEG findings in hepatic encephalopathy include:\n\n1. **Bilateral synchronous delta waves**: This is more characteristic of diffuse cortical dysfunction but is not specific to hepatic coma.\n2. **Sharp triphasic waves**: This is a classic EEG finding associated with hepatic encephalopathy. These waves are typically seen in patients with liver failure.\n3. **Generalized slowing with focal asymmetry**: This finding can occur in various encephalopathies but is not specific to hepatic coma.\n4. **Normal EEG recording**: This would not be expected in hepatic coma, as there are usually significant changes observed.\n5. **Periodic bursts of high-amplitude sharp waves**: This finding is more commonly associated with other conditions, such as seizures or certain types of encephalopathy.\n\nGiven that sharp triphasic waves are specifically associated with hepatic encephalopathy, we can conclude that this is the most characteristic EEG finding for hepatic coma.\n\nSo, the answer is (B) Sharp triphasic waves."}
{"number": 56, "chunk_path": "_/Allan_H_chunks_4000.json:chunk_56", "question": "Which of the following findings is most indicative of a lesion in the visual pathways based on pattern-shift visual evoked responses?", "options": {"A": "Prolonged latency of P100 greater than 118 ms from the left eye", "B": "Increase in amplitude of response from both eyes", "C": "Normal latency measurements for both eyes", "D": "Equal interwave latency between lumbar and cortical responses", "E": "Reduced duration of PSVER from the right eye"}, "answer": "A", "chain_of_thought": "To answer the question, we need to analyze what the pattern-shift visual evoked responses (PSVER) indicate regarding lesions in the visual pathways. \n\n1. **Understanding PSVER**: Pattern-shift visual evoked responses are used to assess the function of the visual pathways by measuring the brain's electrical response to visual stimuli. Abnormalities in these responses can indicate lesions in the visual pathways.\n\n2. **Analyzing the options**:\n   - **A) Prolonged latency of P100 greater than 118 ms from the left eye**: A prolonged latency, especially over a certain threshold (like 118 ms), is typically indicative of a lesion or dysfunction in the visual pathways.\n   - **B) Increase in amplitude of response from both eyes**: An increase in amplitude could suggest enhanced sensitivity or excitability, but it is not typically indicative of a lesion.\n   - **C) Normal latency measurements for both eyes**: Normal latencies would suggest intact visual pathways, which is not indicative of a lesion.\n   - **D) Equal interwave latency between lumbar and cortical responses**: This pertains more to spinal and cortical transmission rather than specifically to lesions in the visual pathways.\n   - **E) Reduced duration of PSVER from the right eye**: A reduced duration might indicate some abnormality but is less specific for a lesion compared to prolonged latency.\n\n3. **Most Indicative Finding**: Among the options, the prolonged latency of P100 greater than So, the answer is (A)."}
{"number": 57, "chunk_path": "_/Allan_H_chunks_4000.json:chunk_57", "question": "What might an abnormal pattern-shift visual evoked response (PSVER) indicate?", "options": {"A": "It suggests active or residual disease of the optic nerve, potentially associated with conditions like multiple sclerosis.", "B": "It indicates normal functioning of the visual pathways, regardless of the patient's symptoms.", "C": "It usually correlates with conditions unrelated to the optic nerve.", "D": "It only signifies issues in the anterior segment of the eye.", "E": "It is solely indicative of age-related visual changes."}, "answer": "A", "chain_of_thought": "To solve the question, we need to understand what an abnormal pattern-shift visual evoked response (PSVER) indicates in a medical context. \n\n1. **Understanding PSVER**: A visual evoked response (VER) is an electrical signal in the brain that is triggered by visual stimuli. An abnormal PSVER suggests that there is some dysfunction in the visual pathways or the optic nerve.\n\n2. **Evaluating the Options**:\n   - **A)** This option states that an abnormal PSVER suggests active or residual disease of the optic nerve, potentially associated with conditions like multiple sclerosis. This aligns well with the known implications of abnormal visual evoked responses, particularly in the context of demyelinating diseases affecting the optic nerve.\n   - **B)** This option claims it indicates normal functioning of visual pathways, which contradicts the premise of an \"abnormal\" response.\n   - **C)** This option suggests it correlates with conditions unrelated to the optic nerve, which is unlikely since PSVER is specifically related to the visual system and optic nerve health.\n   - **D)** This option indicates issues only in the anterior segment of the eye. However, PSVER is related to the central nervous system response to visual stimuli, not just the anterior segment.\n   - **E)** This option suggests it is solely indicative of age-related visual changes, which is misleading because while age can affect visual pathways, an abnormal response is more specific to pathology.\n\n3. **Conclusion**: The most appropriate So, the answer is (A)."}
{"number": 58, "chunk_path": "_/Allan_H_chunks_4000.json:chunk_58", "question": "Which of the following statements is true regarding Brainstem Auditory Evoked Potentials (BAEPs) in the context of detecting lesions in the auditory pathway?", "options": {"A": "BAEPs are only useful in identifying lesions when clinical symptoms are present.", "B": "Prolongation of interwave latencies I to III or III to V can indicate lesions in the eighth cranial nerve.", "C": "BAEPs are sensitive to lesions in the auditory cortex but not in the brainstem.", "D": "The presence of wave VII is crucial for determining the integrity of the auditory nerve."}, "answer": "B", "chain_of_thought": "To solve the question regarding Brainstem Auditory Evoked Potentials (BAEPs) and their role in detecting lesions in the auditory pathway, let's break down the provided options:\n\nA) BAEPs are only useful in identifying lesions when clinical symptoms are present.\n- This statement is misleading. BAEPs can detect lesions even in the absence of clinical symptoms.\n\nB) Prolongation of interwave latencies I to III or III to V can indicate lesions in the eighth cranial nerve.\n- This statement is accurate. Prolongation of these interwave latencies is indeed associated with lesions in the auditory pathway, particularly involving the eighth cranial nerve (the vestibulocochlear nerve).\n\nC) BAEPs are sensitive to lesions in the auditory cortex but not in the brainstem.\n- This statement is incorrect. BAEPs are primarily used to assess the integrity of the auditory pathway through the brainstem, not the auditory cortex.\n\nD) The presence of wave VII is crucial for determining the integrity of the auditory nerve.\n- There is no wave VII in BAEPs; typically, only waves I to VI are observed. Therefore, this statement is incorrect.\n\nGiven this analysis, option B stands out as the only correct statement regarding the utility of BAEPs in identifying lesions in the auditory pathway.\n\nSo, the answer is (B) Prolongation of interwave latencies I to III or III to V can indicate lesions in the eighth cranial nerve."}
{"number": 60, "chunk_path": "_/Allan_H_chunks_4000.json:chunk_60", "question": "A 42-year-old male presents with right-sided hemiplegia following a cerebrovascular accident (CVA). Despite rehabilitation efforts, he exhibits minimal functional recovery. The physician is interested in assessing the status of his corticospinal motor system using a non-invasive technique. Which method would be best suited for this evaluation?", "options": {"A": "Functional MRI of the brain ", "B": "Transcranial Motor Cortex Stimulation ", "C": "Electromyography of the affected muscles ", "D": "Comprehensive neuropsychological assessment ", "E": "Computed Tomography Angiography "}, "answer": "B", "chain_of_thought": "To solve this question, we need to analyze the patient's condition and the available diagnostic methods to assess the corticospinal motor system.\n\n1. **Patient's Condition**: The patient is a 42-year-old male with right-sided hemiplegia due to a cerebrovascular accident (CVA). This indicates damage to the motor pathways, likely affecting the corticospinal tract.\n\n2. **Assessment Goal**: The physician wants to assess the status of the corticospinal motor system. This system is crucial for voluntary motor control, and understanding its status post-CVA is important for rehabilitation and prognosis.\n\n3. **Options Analysis**:\n   - **A) Functional MRI of the brain**: This can provide information on brain activity and areas involved in motor function but is not specifically tailored to assess the corticospinal tract function directly.\n   - **B) Transcranial Motor Cortex Stimulation**: This method stimulates the motor cortex and assesses the resulting motor responses. It is a direct way to evaluate corticospinal tract integrity and function non-invasively.\n   - **C) Electromyography of the affected muscles**: This focuses on muscle activity and may not provide direct information about the central corticospinal pathways.\n   - **D) Comprehensive neuropsychological assessment**: This evaluates cognitive functions and is not specific to motor system assessment.\n   - **E) Computed Tomography Angiography**: This is used to visualize blood vessels and assess for vascular issues, not So, the answer is (B)."}
{"number": 62, "chunk_path": "_/Allan_H_chunks_4000.json:chunk_62", "question": "In which situation is a temporal artery biopsy indicated?", "options": {"A": "When multiple sclerosis is suspected", "B": "When giant cell arteritis is suspected", "C": "To evaluate peripheral nerve damage", "D": "In cases of meningitis", "E": "When assessing myasthenia gravis"}, "answer": "B", "chain_of_thought": "To determine when a temporal artery biopsy is indicated, we need to consider the conditions that warrant this procedure. \n\nTemporal artery biopsy is specifically used to diagnose giant cell arteritis (also known as temporal arteritis), which is an inflammatory condition that affects the blood vessels, particularly the temporal arteries. Symptoms may include headache, scalp tenderness, vision problems, and jaw claudication. \n\nNow, let's evaluate the options provided:\n\nA) When multiple sclerosis is suspected - This condition is related to the central nervous system and does not require a temporal artery biopsy.\n\nB) When giant cell arteritis is suspected - This is the primary indication for a temporal artery biopsy, as it helps confirm the diagnosis.\n\nC) To evaluate peripheral nerve damage - A temporal artery biopsy would not be used for this purpose.\n\nD) In cases of meningitis - Meningitis is an infection of the membranes covering the brain and spinal cord and does not involve a temporal artery biopsy.\n\nE) When assessing myasthenia gravis - This is an autoimmune disorder affecting neuromuscular transmission and is not related to the temporal arteries.\n\nBased on this analysis, the correct answer is clear.\n\nSo, the answer is (B) When giant cell arteritis is suspected."}
{"number": 63, "chunk_path": "_/Allan_H_chunks_4000.json:chunk_63", "question": "Which part of the nervous system is considered the highest level of motor control according to Hughlings Jackson's hierarchical model?", "options": {"A": "Cerebellum", "B": "Basal ganglia", "C": "Motor neurons of the posterior frontal region", "D": "Prefrontal parts of the cerebrum", "E": "Spinal and brainstem neurons"}, "answer": "D", "chain_of_thought": "To solve this question, we need to understand Hughlings Jackson's hierarchical model of the nervous system, particularly regarding motor control.\n\n1. **Hierarchy of Motor Control**: Hughlings Jackson proposed a model that categorizes different parts of the nervous system based on their roles in motor control, with certain areas being more complex and higher in the hierarchy than others.\n\n2. **Options Analysis**:\n   - **A) Cerebellum**: The cerebellum plays a crucial role in coordination and fine-tuning of movements, but it is not the highest level of motor control.\n   - **B) Basal ganglia**: The basal ganglia are involved in the regulation of voluntary motor movements and play a significant role in movement initiation and control, but they also do not represent the highest level.\n   - **C) Motor neurons of the posterior frontal region**: These neurons are responsible for sending signals to muscles but are not considered the highest level of motor control.\n   - **D) Prefrontal parts of the cerebrum**: The prefrontal cortex is involved in higher cognitive functions, including planning and decision-making, which can influence motor control, but it is not specifically the highest motor control area.\n   - **E) Spinal and brainstem neurons**: These are lower-level structures that control basic reflexes and motor functions.\n\n3. **Conclusion**: In Jackson's model, the highest level of motor control is associated with the planning and execution of So, the answer is (D)."}
{"number": 64, "chunk_path": "_/Allan_H_chunks_4000.json:chunk_64", "question": "A 72-year-old woman is brought to the clinic by her family due to progressive difficulty in motor control and stability. She has noticed that her walking is unsteady, and she frequently loses her balance. The family reports that she has also become increasingly slow in her movements. Neurological examination reveals diminished muscle tone and difficulty performing rapid movements. Which part of the nervous system is likely most affected in this patient\u2019s condition?", "options": {"A": "Anterior motor neurons in the spinal cord", "B": "Basal ganglia", "C": "Motor neurons in the frontal cortex", "D": "Brainstem nuclei", "E": "Cerebellum"}, "answer": "E", "chain_of_thought": "To analyze this clinical scenario, we first summarize the key details:\n\n- The patient is a 72-year-old woman with progressive difficulty in motor control and stability.\n- She experiences unsteady walking and frequent loss of balance.\n- There is a noticeable slowing of movements, and neurological examination shows diminished muscle tone and difficulty with rapid movements.\n\nNext, we consider the implications of these symptoms:\n\n1. **Unsteady walking and loss of balance** suggest issues with coordination and motor control, which are typically associated with the cerebellum.\n2. **Slowness of movements** can indicate a problem with the basal ganglia, which is involved in the regulation of voluntary motor control and movement planning.\n3. **Diminished muscle tone** might suggest a lower motor neuron issue, but in this case, the context points more towards dysfunction in the central nervous system affecting coordination.\n\nNow, we evaluate the options:\n\nA) **Anterior motor neurons in the spinal cord** - These are involved in muscle strength and tone but wouldn't primarily explain the balance and coordination issues.\n\nB) **Basal ganglia** - This is relevant for movement regulation and could explain slowness of movement, but it does not primarily account for the balance and coordination issues.\n\nC) **Motor neurons in the frontal cortex** - While the frontal cortex is involved in motor planning, the symptoms presented are more indicative of coordination issues rather than planning.\n\nD) **Brainstem nuclei** - These are involved in basic motor control and reflexes So, the answer is (E)."}
{"number": 65, "chunk_path": "_/Allan_H_chunks_4000.json:chunk_65", "question": "Which type of motor disorder is characterized by an interruption of lower motor neurons?", "options": {"A": "Apraxic disturbances of purposive movement", "B": "Involuntary movements due to basal ganglia disease", "C": "Abnormalities of coordination due to cerebellar lesions", "D": "Paralysis", "E": "Paralysis due to dysfunction of upper motor neurons"}, "answer": "D", "chain_of_thought": "To solve the question, we need to analyze the information provided and the options given.\n\nThe question specifically asks for the type of motor disorder that is characterized by an interruption of lower motor neurons. \n\n1. **Understanding Lower Motor Neurons**: Lower motor neurons are the final common pathway for motor signals to muscles. They are located in the spinal cord and brainstem, and their interruption leads to specific symptoms.\n\n2. **Options Analysis**:\n   - **A) Apraxic disturbances of purposive movement**: Apraxia is related to the brain's ability to plan and execute movements, which is more related to cortical function rather than lower motor neuron issues.\n   - **B) Involuntary movements due to basal ganglia disease**: This refers to movement disorders like Parkinson's or Huntington's disease, which primarily involve the basal ganglia, not lower motor neurons.\n   - **C) Abnormalities of coordination due to cerebellar lesions**: This pertains to issues with the cerebellum, affecting coordination, rather than the lower motor neuron system.\n   - **D) Paralysis**: This is a general term that can occur due to lower motor neuron lesions (flaccid paralysis) as they disrupt muscle activation.\n   - **E) Paralysis due to dysfunction of upper motor neurons**: This describes spastic paralysis, which is not caused by lower motor neuron interruption but rather by dysfunction in the brain or spinal cord affecting upper motor pathways.\n\n3. ** So, the answer is (D)."}
{"number": 67, "chunk_path": "_/Allan_H_chunks_4000.json:chunk_67", "question": "A 65-year-old man presents with weakness in his left foot, specifically experiencing difficulty in lifting his toes. Upon examination, you note an inability to extend the toes and a foot drop when he walks. Which spinal nerve root is likely affected in this patient?", "options": {"A": "L3", "B": "L4", "C": "L5", "D": "S1", "E": "S2"}, "answer": "C", "chain_of_thought": "To solve the question, we need to analyze the symptoms presented and the corresponding spinal nerve roots involved in foot movement.\n\n1. **Patient's Symptoms**: The patient is a 65-year-old man who has weakness in his left foot, specifically with difficulty in lifting his toes, which indicates an issue with toe extension. He also exhibits a \"foot drop\" when walking, meaning he cannot lift the front part of his foot.\n\n2. **Understanding Foot Drop**: Foot drop is a condition where the front part of the foot drops down, usually due to weakness in the muscles that lift the toes. This is commonly associated with issues in the peroneal nerve, which is derived from the L4, L5, S1, and S2 spinal nerve roots.\n\n3. **Nerve Root Involvement**:\n    - **L3**: Primarily involved in knee extension and does not directly affect toe movement.\n    - **L4**: Weakness may cause some issues with foot dorsiflexion, but less common for toe extension specifically.\n    - **L5**: This root is particularly involved in the control of the muscles that extend the toes (particularly the extensor digitorum longus and tibialis anterior).\n    - **S1**: More related to plantar flexion and foot movements, not specifically toe extension.\n    - **S2**: Primarily involved in the posterior compartment of the leg.\n\n4. **Conclusion**: Given the So, the answer is (C)."}
{"number": 68, "chunk_path": "_/Allan_H_chunks_4000.json:chunk_68", "question": "A 65-year-old woman presents to the clinic with difficulty standing up from a seated position and noticeable weakness in her legs. Neurological examination reveals diminished deep tendon reflexes and decreased muscle tone in the lower extremities. Based on this presentation, which of the following spinal structures is likely impaired?", "options": {"A": "Alpha motor neurons in the anterior horn", "B": "Gamma motor neurons in the anterior horn", "C": "Muscle spindles", "D": "Golgi tendon organs", "E": "Descending fiber systems"}, "answer": "A", "chain_of_thought": "To solve this question, let\u2019s summarize the clinical presentation and analyze the options based on our understanding of spinal structures and their functions.\n\nThe patient is a 65-year-old woman with:\n- Difficulty standing up from a seated position\n- Noticeable weakness in her legs\n- Diminished deep tendon reflexes\n- Decreased muscle tone in the lower extremities\n\nFrom this information, we can infer that there is likely an issue with the motor control of her legs. The weakness and decreased muscle tone suggest a problem with the lower motor neurons, which are responsible for innervating the muscles and controlling movement.\n\nNow, let's evaluate the options provided:\n\nA) Alpha motor neurons in the anterior horn: These are the lower motor neurons that directly innervate skeletal muscle. Impairment here would lead to weakness and decreased muscle tone, aligning with the patient's symptoms.\n\nB) Gamma motor neurons in the anterior horn: These neurons are involved in the regulation of muscle spindle sensitivity and do not directly innervate skeletal muscle for movement. The symptoms do not strongly indicate an impairment of gamma motor neurons.\n\nC) Muscle spindles: These are proprioceptors that detect changes in muscle length and play a role in reflexes, but they are not responsible for muscle contraction. The symptoms point more toward motor neuron impairment.\n\nD) Golgi tendon organs: These receptors sense tension in muscles and help regulate muscle contraction but do not directly cause weakness or decreased tone.\n\nE) Descending fiber systems: These fibers So, the answer is (A)."}
{"number": 69, "chunk_path": "_/Allan_H_chunks_4000.json:chunk_69", "question": "Which of the following components plays a crucial role in the response of the muscle to stretch during a tendon reflex?", "options": {"A": "Alpha motor neurons ", "B": "Gamma motor neurons ", "C": "Golgi tendon organs ", "D": "Inhibitory interneurons ", "E": "Muscle spindles "}, "answer": "E", "chain_of_thought": "To determine which component plays a crucial role in the response of the muscle to stretch during a tendon reflex, we need to consider the functions of the options provided:\n\nA) **Alpha motor neurons**: These neurons are responsible for the contraction of extrafusal muscle fibers but do not directly sense stretch.\n\nB) **Gamma motor neurons**: These neurons innervate intrafusal muscle fibers within the muscle spindle but are not primarily responsible for the stretch reflex response.\n\nC) **Golgi tendon organs**: These structures sense tension and are involved in the reflex that protects muscles from excessive force, not specifically stretch.\n\nD) **Inhibitory interneurons**: These neurons can mediate reflex pathways but do not directly respond to stretch.\n\nE) **Muscle spindles**: These are sensory receptors located in the muscle that detect changes in muscle length (stretch) and the rate of that change. They are critical in mediating the stretch reflex, which involves a direct response to muscle stretch.\n\nGiven this analysis, the components that play the most crucial role in responding to muscle stretch during a tendon reflex are the muscle spindles.\n\nSo, the answer is (E) Muscle spindles."}
{"number": 71, "chunk_path": "_/Allan_H_chunks_4000.json:chunk_71", "question": "A 45-year-old woman presents with flaccid paralysis and areflexia in her right arm following a recent trauma. There are no sensory changes noted in the affected limb. Based on this clinical presentation, where is the most likely location of her lesion?", "options": {"A": "In the anterior gray matter of the spinal cord", "B": "In the posterior roots of the periphery", "C": "In the mixed motor and sensory nerves", "D": "In the motor axons alone", "E": "In the peripheral muscle itself"}, "answer": "A", "chain_of_thought": "To analyze the clinical presentation of the 45-year-old woman, we note the following key points:\n\n1. **Symptoms**: The woman has flaccid paralysis and areflexia in her right arm.\n2. **Trauma**: The symptoms appeared following a recent trauma, which suggests a possible injury to the nervous system.\n3. **No sensory changes**: The absence of sensory changes indicates that the sensory pathways are likely intact, and the problem might be primarily motor.\n\nGiven these details, we need to identify the most likely location of the lesion based on the options provided:\n\nA) **In the anterior gray matter of the spinal cord**: This is where lower motor neurons reside. A lesion here could cause flaccid paralysis and areflexia, as it directly affects motor output.\n\nB) **In the posterior roots of the periphery**: A lesion here would typically affect sensory function, which contradicts the absence of sensory changes noted in the patient.\n\nC) **In the mixed motor and sensory nerves**: While a lesion here could lead to motor and sensory deficits, the absence of sensory changes suggests this option is less likely.\n\nD) **In the motor axons alone**: This could also lead to flaccid paralysis, but it does not specify whether sensory axons are affected, which aligns with the lack of sensory changes. \n\nE) **In the peripheral muscle itself**: Lesions in the muscle might cause weakness or paralysis, but not typically are So, the answer is (A)."}
{"number": 72, "chunk_path": "_/Allan_H_chunks_4000.json:chunk_72", "question": "What is the primary origin of the corticospinal tracts in the human brain?", "options": {"A": "Premotor area 6", "B": "Primary motor cortex (area 4 of Brodmann)", "C": "Superior parietal lobule (areas 5 and 7)", "D": "Primary somatosensory cortex (Brodmann's areas 3, 1, and 2)", "E": "Medial thalamus"}, "answer": "B", "chain_of_thought": "To answer the question about the primary origin of the corticospinal tracts in the human brain, we first need to understand the specific areas of the brain involved in motor control.\n\n1. **Understanding the Corticospinal Tracts**: The corticospinal tracts are major pathways that convey motor signals from the brain to the spinal cord. These tracts are crucial for voluntary motor control, particularly for fine motor movements.\n\n2. **Identifying the Potential Origins**:\n   - **A) Premotor area 6**: This area is involved in planning and coordinating movements but is not the primary origin of the corticospinal tracts.\n   - **B) Primary motor cortex (area 4 of Brodmann)**: This area is directly responsible for executing voluntary motor control and is known to be the primary source of the corticospinal tracts.\n   - **C) Superior parietal lobule (areas 5 and 7)**: This region is involved in sensory integration and spatial awareness but does not serve as the primary origin for the corticospinal tracts.\n   - **D) Primary somatosensory cortex (Brodmann's areas 3, 1, and 2)**: This area processes sensory information but is not the source of the corticospinal tracts.\n   - **E) Medial thalamus**: This is a relay station for sensory and motor information but not the primary origin of the corticospinal tr So, the answer is (B)."}
{"number": 74, "chunk_path": "_/Allan_H_chunks_4000.json:chunk_74", "question": "A 65-year-old man presents with weakness predominantly affecting his right arm and face while his right leg remains relatively unaffected. Neurological examination reveals no sensory deficits, and imaging shows a small lesion in the posterior limb of the internal capsule. Which type of motor impairment is he most likely experiencing?", "options": {"A": "Pure motor hemiplegia", "B": "Facial weakness without limb involvement", "C": "Upper motor neuron lesion affecting the leg more than the arm", "D": "Dysarthria with contralateral weakness of the limbs", "E": "Complete hemiplegia with sensory loss"}, "answer": "A", "chain_of_thought": "To solve this question, let's analyze the information provided:\n\n1. **Patient Profile**: A 65-year-old man with weakness in his right arm and face. His right leg is relatively unaffected. This suggests a neurological issue affecting the motor pathways controlling these regions.\n\n2. **Neurological Examination**: The absence of sensory deficits indicates that the impairment is primarily motor. \n\n3. **Imaging Results**: A small lesion in the posterior limb of the internal capsule has been found. The internal capsule is crucial for motor control, and lesions here can lead to specific patterns of weakness.\n\n4. **Understanding Motor Impairment**: \n   - The weakness affecting the right arm and face suggests that the lesion may be impacting areas of the motor cortex that control these regions, which correspond to the left side of the brain due to contralateral control.\n   - The right leg being relatively unaffected points towards a selective motor impairment rather than a complete hemiplegia, which would typically involve all limbs.\n\nNow, let's evaluate the options:\n- **A) Pure motor hemiplegia**: This would typically involve complete weakness of one side of the body. Given that the right leg is relatively unaffected, this option doesn't fit.\n  \n- **B) Facial weakness without limb involvement**: The patient has arm weakness, so this option does not apply.\n\n- **C) Upper motor neuron lesion affecting the leg more than the arm**: This contradicts the findings as the leg is less So, the answer is (A)."}
{"number": 75, "chunk_path": "_/Allan_H_chunks_4000.json:chunk_75", "question": "A 45-year-old patient with difficulty coordinating movements of the left side of her body presents for evaluation. MRI shows no structural abnormalities. Which area of the brain is primarily responsible for the coordination of these movements, as indicated by its role in integrating various muscle group contractions?", "options": {"A": "Primary motor cortex (Area 4)", "B": "Premotor cortex (Area 6)", "C": "Supplementary motor area", "D": "Sensory cortex", "E": "Visual cortex"}, "answer": "B", "chain_of_thought": "To solve this question, we need to analyze the symptoms of the patient and the options provided. The patient is a 45-year-old with difficulty coordinating movements on the left side of her body. This suggests that there may be an issue with the part of the brain that controls movement and coordination, particularly on the right side of the brain, since motor control is contralateral. \n\nThe MRI shows no structural abnormalities, which means that the issue may not be due to a lesion but potentially a functional problem. \n\nNow, let's look at the options provided:\n\nA) **Primary motor cortex (Area 4)** - This area is primarily responsible for initiating voluntary movements. However, it is not primarily responsible for coordinating movements.\n\nB) **Premotor cortex (Area 6)** - This area is involved in preparing and coordinating movements, particularly the planning of movements, and integrating information for the execution of coordinated actions.\n\nC) **Supplementary motor area** - This area is involved in the planning of complex movements and coordination of movements, especially those that require both sides of the body to work together.\n\nD) **Sensory cortex** - This area processes sensory information and is not directly involved in the coordination of movement.\n\nE) **Visual cortex** - This area processes visual information and is not involved in motor coordination.\n\nGiven that the question specifically asks for the area responsible for the coordination of movements, the **premotor cortex (Area 6)** and the **supplementary motor area** are So, the answer is (B)."}
{"number": 76, "chunk_path": "_/Allan_H_chunks_4000.json:chunk_76", "question": "Which of the following statements best describes the organization of the motor cortex in controlling movements?", "options": {"A": "The motor cortex is organized around individual muscle contractions.", "B": "The motor cortex controls movements through discrete motor units located throughout the cortex.", "C": "The motor cortex is primarily engaged in the coordinated contraction of groups of muscles.", "D": "The activity in motor cortex is mainly responsible for inhibition of voluntary motor activity.", "E": "Motor cortex stimulation only elicits reflex movements."}, "answer": "C", "chain_of_thought": "To analyze the question about the organization of the motor cortex in controlling movements, let's break down the provided options:\n\nA) The motor cortex is organized around individual muscle contractions.\n- This statement suggests that the motor cortex is focused solely on individual muscles, which is not entirely accurate. The motor cortex does not operate in isolation of muscle contractions.\n\nB) The motor cortex controls movements through discrete motor units located throughout the cortex.\n- This implies that motor units are scattered throughout the cortex, which is not how the motor cortex functions. The motor cortex is more about controlling movements rather than being organized by motor units.\n\nC) The motor cortex is primarily engaged in the coordinated contraction of groups of muscles.\n- This statement indicates that the motor cortex is involved in planning and executing coordinated movements involving multiple muscle groups, which aligns with our understanding of the motor cortex's role.\n\nD) The activity in motor cortex is mainly responsible for inhibition of voluntary motor activity.\n- While there is some inhibition involved in motor control, the primary role of the motor cortex is to facilitate voluntary movements rather than inhibit them.\n\nE) Motor cortex stimulation only elicits reflex movements.\n- This statement is incorrect as stimulation of the motor cortex can produce voluntary movements, not just reflexes.\n\nAfter analyzing each option, option C stands out as the best description of the organization of the motor cortex. It highlights the motor cortex's role in coordinating movements across multiple muscle groups rather than focusing on individual muscles or reflexes.\n\nSo, the answer is (C)"}
{"number": 77, "chunk_path": "_/Allan_H_chunks_4000.json:chunk_77", "question": "Which area of the brain is primarily responsible for sustaining set discharges in response to planned movements?", "options": {"A": "Motor cortex", "B": "Premotor cortex", "C": "Supplementary motor cortex", "D": "Prefrontal cortex", "E": "Cerebellum"}, "answer": "C", "chain_of_thought": "To determine which area of the brain is primarily responsible for sustaining set discharges in response to planned movements, we can evaluate the roles of each of the given brain regions:\n\nA) **Motor cortex**: This area is involved in executing voluntary movements but is not primarily responsible for sustaining planned movements.\n\nB) **Premotor cortex**: This region is involved in the planning of movements and prepares the motor cortex for action, but it does not primarily sustain discharges.\n\nC) **Supplementary motor cortex**: This area is crucial for the planning and coordination of movements, particularly those that are internally generated. It helps sustain set discharges in response to planned movements.\n\nD) **Prefrontal cortex**: This area is involved in higher cognitive functions, including decision-making and planning, but it is not directly responsible for sustaining motor discharges.\n\nE) **Cerebellum**: This region is important for coordination and timing of movements but does not handle the sustained discharges related to planning.\n\nGiven this analysis, the **Supplementary motor cortex** (option C) is the most directly involved in sustaining set discharges in response to planned movements. \n\nSo, the answer is (C) Supplementary motor cortex."}
{"number": 78, "chunk_path": "_/Allan_H_chunks_4000.json:chunk_78", "question": "What is the expected clinical presentation of upper motor neuron paralysis due to lesions in the corticospinal pathway?", "options": {"A": "severe hemiplegia and increased muscle tone ", "B": "flaccid paralysis of muscles ", "C": "initial hypotonia followed by atrophy ", "D": "muscle weakness and sensory loss ", "E": "muscle fasciculations and cramps "}, "answer": "A", "chain_of_thought": "To answer the question on the expected clinical presentation of upper motor neuron paralysis due to lesions in the corticospinal pathway, we need to review what upper motor neuron (UMN) lesions typically present like.\n\n1. **Understanding Upper Motor Neurons**: Upper motor neurons originate in the brain and project down to the spinal cord, where they synapse with lower motor neurons. Damage to these pathways can lead to characteristic signs and symptoms.\n\n2. **Clinical Features of UMN Lesions**:\n   - **Muscle Tone**: UMN lesions typically result in increased muscle tone (spasticity).\n   - **Reflexes**: There is often hyperreflexia (increased reflexes).\n   - **Strength**: Patients may experience weakness, but the muscles are not flaccid; instead, they are rigid or spastic.\n   - **Atrophy**: Muscle atrophy can occur over time but is not immediate and is less pronounced than in lower motor neuron lesions.\n   - **Fasciculations**: These are not seen in UMN lesions but are more characteristic of lower motor neuron lesions.\n\n3. **Analyzing the Options**:\n   - **A) Severe hemiplegia and increased muscle tone**: This option describes the expected findings in UMN lesions, including increased tone.\n   - **B) Flaccid paralysis of muscles**: This is characteristic of lower motor neuron lesions.\n   - **C) Initial hypotonia followed by atrophy So, the answer is (A)."}
{"number": 79, "chunk_path": "_/Allan_H_chunks_4000.json:chunk_79", "question": "Which type of paralysis is characterized by weakness and spasticity resulting from lesions affecting the corticospinal and extrapyramidal systems?", "options": {"A": "Flaccid paralysis ", "B": "Lower motor neuron paralysis ", "C": "Upper motor neuron paralysis ", "D": "Bilateral muscular paralysis ", "E": "Neuropathic paralysis "}, "answer": "C", "chain_of_thought": "To solve the question, we need to analyze the key terms and concepts presented.\n\n1. **Key Terms**: The question mentions \"weakness and spasticity,\" \"lesions,\" \"corticospinal,\" and \"extrapyramidal systems.\"\n   \n2. **Understanding Paralysis Types**:\n   - **Flaccid Paralysis**: This type is characterized by weakness and loss of muscle tone due to lower motor neuron lesions, leading to limp, weak muscles.\n   - **Lower Motor Neuron Paralysis**: This also involves flaccid paralysis, resulting from damage to lower motor neurons, affecting muscle strength and reflexes.\n   - **Upper Motor Neuron Paralysis**: This type is associated with lesions in the corticospinal tract and causes weakness and spasticity (increased muscle tone and reflexes) due to the loss of inhibitory control over lower motor neurons.\n   - **Bilateral Muscular Paralysis**: This describes paralysis affecting both sides of the body but does not specify the mechanism.\n   - **Neuropathic Paralysis**: This term is broad and can refer to paralysis due to nerve damage, but does not specifically relate to the corticospinal or extrapyramidal systems.\n\n3. **Identifying the Correct Answer**: \n   - The question specifically states that the paralysis is due to lesions affecting the corticospinal and extrapyramidal systems, which aligns with upper motor neuron paralysis. This type is characterized by weakness and sp So, the answer is (C)."}
{"number": 80, "chunk_path": "_/Allan_H_chunks_4000.json:chunk_80", "question": "A 70-year-old man presents with right-sided weakness and difficulty speaking. Neurological examination reveals upper motor neuron signs, including increased tone and brisk reflexes in the right arm and leg. Which observation would be most consistent with upper motor neuron lesions?", "options": {"A": "Involvement of all muscles on the right side of the body", "B": "No movement possible in the right arm", "C": "Preserved bilateral movements of the jaw and pharynx", "D": "Paralyzed muscles exhibit enhanced voluntary control", "E": "Reflexes are absent in the right lower extremity"}, "answer": "C", "chain_of_thought": "To answer the question, we need to analyze the clinical presentation and the characteristics of upper motor neuron lesions.\n\n1. **Clinical Presentation**: The patient is 70 years old and presents with right-sided weakness and difficulty speaking. The neurological exam shows upper motor neuron signs, which include increased tone (spasticity) and brisk reflexes (hyperreflexia) in the right arm and leg. This indicates that the lesions affecting motor control are above the level of the anterior horn cells in the spinal cord.\n\n2. **Understanding Upper Motor Neuron Lesions**: Upper motor neuron lesions typically result in:\n   - Weakness or paralysis of voluntary movement.\n   - Increased muscle tone (spasticity).\n   - Brisk reflexes (hyperreflexia).\n   - Preservation of some reflexes below the level of the lesion.\n   - Generally, there is no muscle atrophy in the early stages because the muscle is still receiving some input from lower motor neurons.\n\n3. **Analyzing the Options**:\n   - **A)** Involvement of all muscles on the right side of the body - Upper motor neuron lesions usually affect specific muscle groups rather than all muscles completely.\n   - **B)** No movement possible in the right arm - This is unlikely; patients with upper motor neuron lesions can have some movement, although it may be weak and uncoordinated.\n   - **C)** Preserved bilateral movements of the jaw and pharynx - These movements are typically controlled by cranial So, the answer is (C)."}
{"number": 81, "chunk_path": "_/Allan_H_chunks_4000.json:chunk_81", "question": "A 62-year-old woman presents with gradual onset of right-sided weakness and increased muscle tone over the past month. A neurological examination reveals spasticity in the right arm and leg, characterized by increased resistance to passive movements. The 'clasp-knife' phenomenon is noted during the examination. What is the most likely pathophysiological mechanism underlying her symptoms?", "options": {"A": "Upper motor neuron lesions", "B": "Lower motor neuron lesions", "C": "Peripheral nerve injury", "D": "Cerebellar dysfunction", "E": "Neuromuscular junction disorder"}, "answer": "A", "chain_of_thought": "To solve this question, let's analyze the details provided.\n\n1. **Patient Profile**: The patient is a 62-year-old woman with right-sided weakness and increased muscle tone that has developed gradually over a month.\n\n2. **Symptoms Described**: \n   - Right-sided weakness suggests a neurological issue affecting motor control.\n   - Increased muscle tone and spasticity indicate that the muscles are more rigid than normal, which is often associated with some neurological conditions.\n   - The 'clasp-knife' phenomenon is a specific sign of upper motor neuron lesions, where there is an initial resistance to passive movement followed by a sudden decrease in resistance.\n\n3. **Neurological Examination Findings**: \n   - Spasticity is a hallmark of upper motor neuron damage. \n   - The presence of the clasp-knife phenomenon specifically points towards dysfunction in the upper motor neurons rather than lower motor neurons or other disorders.\n\n4. **Options Analysis**:\n   - A) Upper motor neuron lesions: This aligns with the symptoms and signs described.\n   - B) Lower motor neuron lesions: This would typically present with flaccid paralysis and decreased muscle tone, which does not fit the patient's presentation.\n   - C) Peripheral nerve injury: Similar to lower motor neuron lesions, this would not cause spasticity.\n   - D) Cerebellar dysfunction: This would typically present with coordination issues rather than spasticity.\n   - E) Neuromuscular junction disorder: This would not cause the So, the answer is (A)."}
{"number": 82, "chunk_path": "_/Allan_H_chunks_4000.json:chunk_82", "question": "A 65-year-old man presents with weakness of the right arm and leg following a stroke. He exhibits an exaggerated response during a neurological exam when the lateral plantar surface of his foot is stroked, resulting in extension of the large toe and fanning of the other toes. What is this finding indicative of?", "options": {"A": "Lower motor neuron lesion", "B": "Upper motor neuron lesion", "C": "Normal neurological function", "D": "Peripheral neuropathy", "E": "Cerebellar dysfunction"}, "answer": "B", "chain_of_thought": "To solve this question, let's summarize the available information:\n\n- We have a 65-year-old man who has experienced weakness in his right arm and leg following a stroke.\n- During a neurological exam, when the lateral plantar surface of his foot is stroked, he exhibits an exaggerated response characterized by extension of the large toe and fanning of the other toes.\n\nNow, let's analyze the neurological findings:\n\n1. The response described (extension of the large toe and fanning of the other toes) is known as the Babinski sign.\n2. The Babinski sign is indicative of an upper motor neuron lesion. In infants, this is a normal reflex due to the immaturity of their nervous system. However, in adults, the presence of this sign suggests damage to the corticospinal tract, which is characteristic of an upper motor neuron lesion.\n3. In contrast, a lower motor neuron lesion would typically present with a different response (often a flexor response) and weakness without the Babinski sign.\n\nGiven the man's age, history of stroke, and the neurological exam findings, it strongly indicates the presence of an upper motor neuron lesion.\n\nSo, the answer is (B) Upper motor neuron lesion."}
{"number": 83, "chunk_path": "_/Allan_H_chunks_4000.json:chunk_83", "question": "A 45-year-old man presents with an upper motor neuron lesion characterized by hyperreflexia and clonus in response to rapid stretching of the ankle. Which of the following signs might you expect to observe upon examination?", "options": {"A": "Positive Babinski sign ", "B": "Areflexia ", "C": "Hypotonia ", "D": "Flaccid paralysis ", "E": "Muscle atrophy "}, "answer": "A", "chain_of_thought": "To approach this question, we start by summarizing the key information provided:\n\n- The patient is a 45-year-old man.\n- He presents with an upper motor neuron lesion.\n- The specific signs noted are hyperreflexia and clonus upon rapid stretching of the ankle.\n\nUpper motor neuron lesions are characterized by several distinct clinical signs. Common features include:\n- Hyperreflexia: Exaggerated reflexes due to a lack of inhibitory signals from the brain.\n- Clonus: A series of involuntary, rhythmic, muscular contractions and relaxations.\n- A positive Babinski sign: An abnormal response to stimulation of the sole of the foot, where the big toe extends upward instead of curling downwards.\n\nNow, let's evaluate the options:\nA) Positive Babinski sign: This is a classic sign of upper motor neuron lesions and would be expected in this scenario.\nB) Areflexia: This refers to the absence of reflexes, which is more characteristic of lower motor neuron lesions, not upper motor neuron lesions.\nC) Hypotonia: This refers to decreased muscle tone, typically associated with lower motor neuron lesions.\nD) Flaccid paralysis: This is also indicative of lower motor neuron lesions, where the muscle becomes weak and limp.\nE) Muscle atrophy: This is more common in lower motor neuron lesions due to disuse and denervation.\n\nGiven the characteristics of upper motor neuron lesions, the most likely sign we would expect to observe is the positive Babinski sign.\n\nSo, So, the answer is (A)."}
{"number": 85, "chunk_path": "_/Allan_H_chunks_4000.json:chunk_85", "question": "A 45-year-old man presents with spasticity and difficulty with fine motor tasks. Neurological examination reveals hyperactivity of the tendon reflexes and an extensor plantar response. Based on these findings, which type of motor neuron paralysis is most likely present?", "options": {"A": "Upper motor neuron paralysis", "B": "Lower motor neuron paralysis", "C": "Cerebellar ataxia", "D": "Neuromuscular junction disorder", "E": "Peripheral neuropathy"}, "answer": "A", "chain_of_thought": "To solve this question, we need to analyze the symptoms and findings provided in the scenario.\n\n1. **Patient Profile**: A 45-year-old man.\n2. **Symptoms**: \n   - Spasticity: This indicates increased muscle tone and stiffness.\n   - Difficulty with fine motor tasks: This suggests impairment in coordination and control of small muscle movements.\n3. **Neurological Examination Findings**:\n   - Hyperactivity of the tendon reflexes: This is a characteristic of upper motor neuron lesions, where reflexes are exaggerated.\n   - Extensor plantar response: This is indicative of upper motor neuron dysfunction. The normal response (flexor plantar response) is absent, and the presence of an extensor response (Babinski sign) suggests damage to the corticospinal tract.\n\nGiven these findings, we can conclude that the symptoms and examination results align with upper motor neuron paralysis. \n\nNow, let's look at the options provided:\n\nA) Upper motor neuron paralysis - This fits with the findings of spasticity, hyperactive reflexes, and an extensor plantar response.\nB) Lower motor neuron paralysis - This typically presents with flaccidity, muscle atrophy, and reduced reflexes, which does not match the patient's presentation.\nC) Cerebellar ataxia - This would involve coordination issues but would not explain the hyperactive reflexes or the extensor plantar response.\nD) Neuromuscular junction disorder - This usually leads to weakness and fatigability rather than hyperactive So, the answer is (A)."}
{"number": 86, "chunk_path": "_/Allan_H_chunks_4000.json:chunk_86", "question": "What is the primary brain region implicated in the planning and initiation of complex motor activities?", "options": {"A": "Occipital lobe", "B": "Temporal lobe", "C": "Frontal lobe", "D": "Cerebellum", "E": "Parietal lobe"}, "answer": "C", "chain_of_thought": "To solve the question about the primary brain region implicated in the planning and initiation of complex motor activities, we need to consider the roles of the different brain regions listed in the options:\n\nA) Occipital lobe - This region is primarily responsible for visual processing, so it is not directly involved in motor activity planning or initiation.\n\nB) Temporal lobe - This region is mainly associated with auditory processing, memory, and language, rather than motor control.\n\nC) Frontal lobe - The frontal lobe is critical for higher cognitive functions, including planning, decision-making, and the initiation of voluntary motor movements. It houses the primary motor cortex and is heavily involved in complex motor activities.\n\nD) Cerebellum - While the cerebellum is essential for coordinating and fine-tuning motor activity and balance, it is not primarily responsible for the planning and initiation of these activities.\n\nE) Parietal lobe - The parietal lobe integrates sensory information, but it does not play a primary role in the planning and initiation of motor activities.\n\nConsidering this analysis, the frontal lobe is the brain region that is most crucial for planning and initiating complex motor activities. \n\nSo, the answer is (C) Frontal lobe."}
{"number": 88, "chunk_path": "_/Allan_H_chunks_4000.json:chunk_88", "question": "A 72-year-old man presents to your clinic with difficulty performing familiar tasks, such as brushing his teeth and using utensils, although he can carry out these tasks automatically when not asked to do so. He has a history of left hemispheric stroke. Which type of apraxia is he most likely experiencing?", "options": {"A": "Ideational apraxia", "B": "Ideomotor apraxia", "C": "Kinetic apraxia", "D": "Developmental motor apraxia", "E": "Facial-oral apraxia"}, "answer": "B", "chain_of_thought": "To solve this question, we need to analyze the patient's symptoms and history to determine the type of apraxia he is likely experiencing. \n\n1. **Patient Profile**: The patient is a 72-year-old man with a history of a left hemispheric stroke. \n2. **Symptoms**: He has difficulty performing familiar tasks, such as brushing his teeth and using utensils, especially when asked to do so. However, he can carry out these tasks automatically when not prompted.\n\n3. **Understanding Apraxia Types**:\n   - **Ideational Apraxia**: This involves the inability to form the appropriate plan to carry out a task. The person may not know what to do with an object.\n   - **Ideomotor Apraxia**: This is characterized by the inability to execute a movement on command, despite knowing what the movement is. They can perform the task automatically, which aligns with the symptoms of the patient.\n   - **Kinetic Apraxia**: This is related to difficulties with the fine motor control required for tasks, often seen in conditions affecting the cerebellum.\n   - **Developmental Motor Apraxia**: This refers to difficulties in motor planning typically seen in developmental delays, not typically in an older patient with a stroke history.\n   - **Facial-Oral Apraxia**: This refers to difficulties in performing movements with the face and mouth, not relevant in this context as the tasks described involve hands.\n\n4. ** So, the answer is (B)."}
{"number": 89, "chunk_path": "_/Allan_H_chunks_4000.json:chunk_89", "question": "A 65-year-old man experiences involuntary movements of his left hand, which seem purposeful but occur without his control. He reports that his left hand frequently reaches into his pockets and performs activities he does not intend, leading to significant embarrassment. What is the most likely diagnosis?", "options": {"A": "ideomotor apraxia", "B": "alien hand syndrome", "C": "developmental motor apraxia", "D": "corticobasal degeneration", "E": "kinetic apraxia"}, "answer": "B", "chain_of_thought": "To solve the question, we need to analyze the symptoms presented:\n\n1. **Involuntary movements of the left hand**: The man is experiencing movements that he cannot control, which suggests a neurological issue.\n   \n2. **Movements seem purposeful but occur without his control**: This indicates that the movements are not random but rather appear to have a purpose, which is characteristic of certain conditions.\n\n3. **Activities include reaching into pockets and performing unintended actions**: The description points towards actions that seem intentional but are not actually under the person's control, which can lead to embarrassment.\n\nNow, let\u2019s evaluate the options given:\n\nA) **Ideomotor apraxia**: This involves difficulty with the execution of movements in response to verbal commands, but the movements are not involuntary or uncontrollable in the manner described.\n\nB) **Alien hand syndrome**: This condition is characterized by the feeling that one\u2019s hand (or limb) is acting on its own, often performing actions that the individual does not intend. This fits the description of involuntary, purposeful movements that lead to embarrassment.\n\nC) **Developmental motor apraxia**: This refers to a developmental disorder where there is difficulty in planning and executing movements, but it does not typically involve the involuntary nature described here.\n\nD) **Corticobasal degeneration**: This is a progressive neurological disorder that can lead to various motor symptoms, but the specific description aligns more with alien hand syndrome.\n\nE) **Kinetic So, the answer is (B)."}
{"number": 90, "chunk_path": "_/Allan_H_chunks_4000.json:chunk_90", "question": "Which of the following types of paralysis refers to weakness or paralysis of all the muscles of one leg or arm?", "options": {"A": "Hemiplegia", "B": "Monoplegia", "C": "Paraplegia", "D": "Quadriplegia", "E": "Triplegia"}, "answer": "B", "chain_of_thought": "To answer the question, we need to understand the definitions of the terms related to paralysis:\n\n1. **Hemiplegia**: This term refers to paralysis affecting one side of the body. It typically involves both the arm and leg on that side.\n  \n2. **Monoplegia**: This term indicates paralysis of a single limb, which can be either an arm or a leg.\n\n3. **Paraplegia**: This refers to paralysis of the lower half of the body, specifically affecting both legs.\n\n4. **Quadriplegia**: This indicates paralysis of all four limbs (both arms and both legs).\n\n5. **Triplegia**: This term generally refers to paralysis of three limbs.\n\nThe question specifically asks for paralysis affecting \"all the muscles of one leg or arm.\" This definition fits best with **Monoplegia**, as it denotes weakness or paralysis of a single limb.\n\nTherefore, the correct answer is:\nSo, the answer is (B) Monoplegia."}
{"number": 92, "chunk_path": "_/Allan_H_chunks_4000.json:chunk_92", "question": "A 58-year-old woman presents with sudden onset weakness on the right side of her body, including her face and arm. She also complains of difficulty speaking, having trouble forming words. Upon examination, she exhibits right-sided hemiplegia and a right homonymous hemianopia. Which of the following likely indicates the site of the lesion responsible for her symptoms?", "options": {"A": "Cerebellum", "B": "Lateral column of the cervical spinal cord", "C": "Cerebral cortex, particularly the left hemisphere", "D": "Pons", "E": "Medulla"}, "answer": "C", "chain_of_thought": "To solve this question, let's summarize the available information regarding the patient:\n\n- The patient is a 58-year-old woman.\n- She presents with sudden onset weakness on the right side of her body (hemiplegia) and difficulty speaking (possible aphasia).\n- Examination shows right-sided hemiplegia, indicating that the problem is on the left side of the brain (since motor control is contralateral).\n- She also has a right homonymous hemianopia, which suggests involvement of the visual pathways that cross in the brain.\n\nNow, let's analyze the options based on the symptoms and what we know about brain anatomy:\n\nA) **Cerebellum** - The cerebellum is primarily involved in coordination and balance, not in speech or hemiplegia. This option does not fit the symptoms.\n\nB) **Lateral column of the cervical spinal cord** - This would not typically cause the symptoms described (sudden onset of right-sided hemiplegia and aphasia). The spinal cord is not the site of lesions that would cause these particular symptoms.\n\nC) **Cerebral cortex, particularly the left hemisphere** - The left hemisphere of the brain controls the right side of the body and is also responsible for speech functions in most right-handed individuals. This matches the patient's symptoms of right-sided weakness and speech difficulties.\n\nD) **Pons** - While lesions in the pons can affect motor function, they typically do not present with isolated hemiplegia So, the answer is (C)."}
{"number": 94, "chunk_path": "_/Allan_H_chunks_4000.json:chunk_94", "question": "A 35-year-old man presents to the emergency department after a motorcycle accident. He has sudden onset of weakness in both legs and difficulty moving his arms. Upon examination, you notice that the patient exhibits loss of reflexes in the lower extremities and sensory loss in the distal limbs. Considering the acute onset of his symptoms, what is the most likely diagnosis?", "options": {"A": "Guillain-Barre syndrome", "B": "Multiple sclerosis", "C": "Acute myelitis", "D": "Transverse myelitis", "E": "Acute spinal cord injury"}, "answer": "E", "chain_of_thought": "To solve this question, let's summarize the available information:\n\n- The patient is a 35-year-old man who suffered a motorcycle accident.\n- He has sudden onset of weakness in both legs and difficulty moving his arms.\n- Examination shows loss of reflexes in the lower extremities and sensory loss in the distal limbs.\n- The symptoms have an acute onset.\n\nNow, let's analyze the options based on the symptoms and context:\n\nA) **Guillain-Barre syndrome**: This is an acute condition that typically begins with weakness and can cause loss of reflexes. However, it usually starts with weakness in the legs and can ascend but does not typically present with a sudden onset of arm weakness after trauma.\n\nB) **Multiple sclerosis**: This condition is characterized by relapsing and remitting neurological symptoms, usually over a longer period. The acute scenario and trauma do not fit well with MS.\n\nC) **Acute myelitis**: This refers to inflammation of the spinal cord and can cause weakness and sensory changes. However, it is less likely in this scenario given the trauma context.\n\nD) **Transverse myelitis**: This involves inflammation across both sides of one segment of the spinal cord, leading to motor, sensory, and reflex changes. It can present acutely but is not typically associated with trauma.\n\nE) **Acute spinal cord injury**: Given the motorcycle accident, the sudden onset of weakness, loss of reflexes, and sensory loss is most consistent with So, the answer is (E)."}
{"number": 95, "chunk_path": "_/Allan_H_chunks_4000.json:chunk_95", "question": "In a child diagnosed with quadriplegia, which causes are most likely related to their condition?", "options": {"A": "Congenital malformation or birth injury to the spinal cord", "B": "Neurodegenerative disorders such as Parkinson's disease", "C": "Acute respiratory infections leading to paralysis", "D": "Traumatic injuries exclusively from sports activities", "E": "Developmental language disorders"}, "answer": "A", "chain_of_thought": "To solve this question, we need to analyze the condition of quadriplegia and the potential causes related to it. Quadriplegia refers to paralysis of all four limbs and is usually caused by damage to the spinal cord or brain. \n\nNow, let's evaluate each option:\n\nA) Congenital malformation or birth injury to the spinal cord - This option is plausible as congenital issues or birth trauma can directly affect the spinal cord, leading to quadriplegia.\n\nB) Neurodegenerative disorders such as Parkinson's disease - While neurodegenerative disorders can cause motor function issues, they typically do not result in quadriplegia in children or are not common causes of it.\n\nC) Acute respiratory infections leading to paralysis - Acute respiratory infections do not cause quadriplegia. Instead, they may lead to breathing difficulties but not paralysis of limbs.\n\nD) Traumatic injuries exclusively from sports activities - While traumatic injuries can cause quadriplegia, they are not the only cause. Moreover, saying \"exclusively from sports\" is too limiting.\n\nE) Developmental language disorders - These disorders do not relate to physical paralysis, as they are primarily concerned with speech and language development.\n\nBased on this analysis, option A stands out as the most relevant cause of quadriplegia in a child. Therefore, the most likely causes related to quadriplegia in a child would be congenital malformation or birth injury to the spinal cord.\n\nSo, the answer is (A) Cong"}
{"number": 97, "chunk_path": "_/Allan_H_chunks_4000.json:chunk_97", "question": "A 45-year-old woman presents with sudden weakness on the right side of her body. During the examination, she exhibits slow, hesitant movements with occasional 'give-way' weakness. On further assessment, Hoover's sign is performed and shows that pressure is felt from her normal left leg when asked to push down. What is the most likely diagnosis based on these findings?", "options": {"A": "Myasthenia gravis", "B": "Hysteria", "C": "Stroke", "D": "Multiple sclerosis", "E": "Peripheral nerve injury"}, "answer": "B", "chain_of_thought": "To solve this question, we need to analyze the clinical presentation and the findings from the examination.\n\n1. **Patient Demographics**: The patient is a 45-year-old woman who has presented with sudden weakness on the right side of her body.\n\n2. **Symptoms**: The key symptom is the \"sudden weakness\" on one side, which may suggest a neurological issue.\n\n3. **Examination Findings**:\n   - The patient exhibits slow, hesitant movements and \"give-way\" weakness, which means she is unable to hold against resistance intermittently.\n   - Hoover's sign is noted, which tests for volitional control and indicates whether the patient is genuinely weak or if the weakness could be functional (psychogenic). A positive Hoover\u2019s sign suggests that the weakness is not due to a primary neurological problem, but rather a result of a psychological issue.\n\n4. **Differential Diagnosis**:\n   - **Myasthenia gravis**: This condition typically causes fluctuating muscle weakness but does not usually present with such sudden unilateral weakness.\n   - **Hysteria**: This is a term historically used for psychological conditions that present with physical symptoms, such as weakness that is not consistent with neurological findings.\n   - **Stroke**: A stroke usually presents with acute onset weakness but typically does not show Hoover's sign as described.\n   - **Multiple sclerosis**: This condition can cause weakness, but it usually presents with more complex symptoms over time, not sudden unilateral weakness with So, the answer is (B)."}
{"number": 98, "chunk_path": "_/Allan_H_chunks_4000.json:chunk_98", "question": "What is the primary mechanism of action for antispasticity drugs?", "options": {"A": "Inhibition of the pyramidal tract", "B": "Enhancement of GABAergic activity", "C": "Blocking acetylcholine receptors", "D": "Selective serotonin reuptake inhibition", "E": "Increase in dopamine levels"}, "answer": "B", "chain_of_thought": "To determine the primary mechanism of action for antispasticity drugs, we need to analyze the options provided and their relation to muscle spasticity.\n\n1. **Inhibition of the pyramidal tract (A)**: This option relates to reducing motor signals from the brain that can cause spasticity. Some antispasticity drugs may influence this pathway, but it's not the primary mechanism.\n\n2. **Enhancement of GABAergic activity (B)**: Many antispasticity medications, such as baclofen, work by enhancing GABA (gamma-aminobutyric acid) activity. GABA is an inhibitory neurotransmitter in the central nervous system, and increasing its activity helps to relax muscles and reduce spasticity.\n\n3. **Blocking acetylcholine receptors (C)**: This mechanism is more related to muscle relaxants that have effects on neuromuscular transmission, rather than a primary action of antispasticity drugs.\n\n4. **Selective serotonin reuptake inhibition (D)**: This option refers to antidepressant mechanisms and does not relate to spasticity treatment.\n\n5. **Increase in dopamine levels (E)**: While dopamine can play a role in muscle control and movement, increasing dopamine levels is not the primary mechanism of action for antispasticity drugs.\n\nFrom this analysis, the option that best fits the known mechanisms of antispasticity drugs is option B, as enhancing GABAergic activity is indeed a common and primary method by which these medications So, the answer is (B)."}
{"number": 99, "chunk_path": "_/Allan_H_chunks_4000.json:chunk_99", "question": "A 65-year-old male presents to the clinic with a history of increased muscle stiffness and occasional tremors in his hands. He exhibits difficulty initiating movements and shows signs of rigidity during the examination. This patient is likely exhibiting which of the following symptoms characteristic of an extrapyramidal syndrome?", "options": {"A": "Increased reflexes and present Babinski sign", "B": "Plastic rigidity and presence of tremor", "C": "Absent involuntary movements and paralysis of voluntary movement", "D": "Normal tone throughout passive movement", "E": "Decreased muscle tone and hypotonia"}, "answer": "B", "chain_of_thought": "To solve the question, we first need to summarize the clinical presentation of the 65-year-old male patient. He has:\n\n- Increased muscle stiffness\n- Occasional tremors in his hands\n- Difficulty initiating movements (bradykinesia)\n- Rigidity during examination\n\nThese symptoms are consistent with an extrapyramidal syndrome, which is often associated with conditions like Parkinson's disease. In extrapyramidal syndromes, we typically see symptoms such as rigidity, tremors, and bradykinesia.\n\nNow, let's analyze the options given:\n\nA) Increased reflexes and present Babinski sign - This is more characteristic of upper motor neuron lesions and not typical of extrapyramidal syndromes.\n\nB) Plastic rigidity and presence of tremor - This option describes rigidity (which is consistent with the patient's increased stiffness) and tremors (consistent with his hand tremors).\n\nC) Absent involuntary movements and paralysis of voluntary movement - This does not match the patient's symptoms, as he is exhibiting involuntary tremors and does not have paralysis.\n\nD) Normal tone throughout passive movement - This contradicts the patient's increased muscle stiffness and rigidity.\n\nE) Decreased muscle tone and hypotonia - This is not applicable here, as the patient exhibits increased muscle tone and rigidity.\n\nBased on the analysis, option B best fits the symptoms presented by the patient, as it describes plastic rigidity and the presence of tremor.\n\nSo, the answer is (B) Plastic rigidity and presence of tremor."}
{"number": 100, "chunk_path": "_/Allan_H_chunks_4000.json:chunk_100", "question": "A 70-year-old man presents with a combination of involuntary movements, including tremors and dystonia, along with features of rigidity and akinesia. What clinical syndrome is most likely indicated in this patient?", "options": {"A": "Corticospinal syndrome", "B": "Extrapyramidal syndrome", "C": "Cerebellar syndrome", "D": "Neuromuscular junction syndrome", "E": "Peripheral neuropathy"}, "answer": "B", "chain_of_thought": "To solve this question, we need to analyze the symptoms presented in the scenario.\n\n1. **Patient Profile**: The patient is a 70-year-old man.\n2. **Symptoms**: He exhibits:\n   - Involuntary movements (which can include tremors and dystonia)\n   - Features of rigidity\n   - Akinesia (difficulty in initiating movement)\n\n3. **Clinical Interpretation**:\n   - The combination of tremors, dystonia, rigidity, and akinesia points towards a neurological condition that affects the basal ganglia.\n   - These symptoms are characteristic of movement disorders, particularly those seen in Parkinson's disease or other forms of extrapyramidal disorders.\n\n4. **Reviewing Options**:\n   - **A) Corticospinal syndrome**: This typically involves weakness and spasticity due to upper motor neuron lesions, not the symptoms described.\n   - **B) Extrapyramidal syndrome**: This includes a range of movement disorders including tremors, rigidity, and bradykinesia (akin to akinesia). This aligns well with the symptoms presented.\n   - **C) Cerebellar syndrome**: This would involve issues like ataxia and balance problems, which are not indicated in the symptoms.\n   - **D) Neuromuscular junction syndrome**: This generally involves muscle weakness and fatigue, rather than the specific movement symptoms described.\n   - **E) Peripheral neuropathy**: This primarily affects sensation and may cause So, the answer is (B)."}
{"number": 101, "chunk_path": "_/Allan_H_chunks_4000.json:chunk_101", "question": "A 65-year-old man presents with tremors at rest and rigidity in his limbs. He reports difficulty initiating movements and has a shuffling gait. Neurological examination shows no signs of paralysis but notable postural instability. Which part of the extrapyramidal motor system is most likely affected in this patient?", "options": {"A": "Cerebellum", "B": "Basal ganglia", "C": "Primary motor cortex", "D": "Spinal cord", "E": "Brainstem"}, "answer": "B", "chain_of_thought": "To solve the question, we need to analyze the symptoms presented by the 65-year-old man. He exhibits:\n\n1. Tremors at rest\n2. Rigidity in limbs\n3. Difficulty initiating movements\n4. Shuffling gait\n5. Notable postural instability\n\nThese symptoms are characteristic of Parkinson's disease, which is a neurological disorder primarily affecting movement. \n\nIn terms of the affected areas within the motor system, we need to consider the roles of the options provided:\n\nA) **Cerebellum** - Involved in coordination and balance, but the symptoms described (resting tremors, rigidity) are not typical of cerebellar disorders.\n\nB) **Basal ganglia** - This structure is critical in the regulation of voluntary motor movements, procedural learning, and routine behaviors. It is well known that Parkinson's disease involves degeneration of the dopaminergic neurons in the basal ganglia, particularly affecting the substantia nigra.\n\nC) **Primary motor cortex** - This area is responsible for the execution of voluntary movements. Damage here typically leads to weakness and paralysis, not the specific symptoms described.\n\nD) **Spinal cord** - While it is crucial for reflexes and basic motor control, it is not typically involved in the symptoms of tremors and rigidity seen in Parkinson's disease.\n\nE) **Brainstem** - This area controls basic life functions and some motor functions, but symptoms of Parkinson's are primarily linked to the basal ganglia.\n\nGiven this So, the answer is (B)."}
{"number": 104, "chunk_path": "_/Allan_H_chunks_4000.json:chunk_104", "question": "In a patient with Parkinson's disease, which of the following pathways is primarily involved in facilitating cortically initiated movements?", "options": {"A": "Indirect pathway through the subthalamic nucleus", "B": "Direct striatomedial pallidonigral pathway", "C": "Reticulospinal pathway", "D": "Corticobulbar pathway", "E": "Medial cortical pathway"}, "answer": "B", "chain_of_thought": "To summarize the available information, we are looking for the pathway that is primarily involved in facilitating cortically initiated movements in a patient with Parkinson's disease. \n\n1. **Understanding Parkinson's Disease**: In Parkinson's disease, there is a degeneration of dopaminergic neurons in the substantia nigra, which affects movement control. The basal ganglia play a crucial role in regulating movement.\n  \n2. **Pathways Involved in Movement**: There are two main pathways in the basal ganglia: the direct pathway and the indirect pathway.\n   - **Direct Pathway**: Facilitates movement. It involves the striatum (caudate and putamen) directly activating the thalamus, which in turn excites the motor cortex.\n   - **Indirect Pathway**: Inhibits movement. It involves the striatum inhibiting the external segment of the globus pallidus, which in turn inhibits the subthalamic nucleus, leading to reduced excitation of the thalamus.\n\n3. **Options Analysis**:\n   - **A) Indirect pathway through the subthalamic nucleus**: This pathway is more about inhibiting movement rather than facilitating it.\n   - **B) Direct striatomedial pallidonigral pathway**: This directly relates to facilitating movement by providing an excitatory signal to the thalamus.\n   - **C) Reticulospinal pathway**: This is involved in posture and locomotion but is not primarily about So, the answer is (B)."}
{"number": 105, "chunk_path": "_/Allan_H_chunks_4000.json:chunk_105", "question": "In Parkinson disease, a decrease in dopaminergic input from the substantia nigra affects which pathway leading to increased pallidothalamic inhibition?", "options": {"A": "Indirect pathway", "B": "Direct pathway", "C": "Striatonigral pathway", "D": "Corticobulbar pathway", "E": "Thalamostriatal pathway"}, "answer": "A", "chain_of_thought": "To solve this question, we need to understand the pathways involved in the basal ganglia and how they are affected in Parkinson's disease.\n\n1. **Understanding Parkinson's Disease**: In Parkinson's disease, there is a degeneration of dopaminergic neurons in the substantia nigra, which leads to a decrease in dopamine levels. This has significant implications for the regulation of movement.\n\n2. **Basal Ganglia Pathways**: The basal ganglia primarily consist of two major pathways:\n   - The **Direct Pathway**: This pathway facilitates movement. In this pathway, dopamine from the substantia nigra excites the striatum, leading to decreased inhibitory output to the thalamus, thereby promoting movement.\n   - The **Indirect Pathway**: This pathway inhibits movement. Dopamine typically inhibits the indirect pathway, which leads to decreased inhibition of the thalamus. When dopaminergic input is reduced, this pathway becomes more active, leading to increased pallidothalamic inhibition (which inhibits the thalamus even more).\n\n3. **Analyzing the Options**:\n   - A) Indirect pathway: This pathway becomes more active in Parkinson's disease due to reduced dopamine, leading to increased inhibition of thalamic activity.\n   - B) Direct pathway: This pathway is inhibited due to the loss of dopaminergic input, which does not lead to increased pallidothalamic inhibition.\n   - C) Striatonigral pathway: This is not So, the answer is (A)."}
{"number": 106, "chunk_path": "_/Allan_H_chunks_4000.json:chunk_106", "question": "In a patient with Parkinson's disease, what is the underlying cause of increased activity in the medial globus pallidus and decreased activity in the lateral globus pallidus?", "options": {"A": "Increased dopaminergic striatal neuron activity directed to the medial pallidum", "B": "Differential loss of activity of dopaminergic striatal neurons projecting to the pallidum", "C": "Enhanced inhibition of thalamocortical neurons caused by thalamic lesions", "D": "Infarcts in the lateral globus pallidus leading to diminished inhibition", "E": "Direct input from the somatosensory cortex to the medial globus pallidus"}, "answer": "B", "chain_of_thought": "To address the question, we need to understand the pathophysiology of Parkinson's disease and how it affects the basal ganglia circuitry, specifically the globus pallidus.\n\n1. **Understanding Parkinson's Disease**: \n   Parkinson's disease is characterized by the degeneration of dopaminergic neurons in the substantia nigra, which leads to a deficiency of dopamine in the striatum. This has significant effects on the output pathways of the basal ganglia.\n\n2. **Basal Ganglia Pathways**:\n   The basal ganglia consist of several nuclei, including the striatum, globus pallidus (both medial and lateral), and substantia nigra. In Parkinson's disease:\n   - The loss of dopaminergic input leads to increased activity in the medial globus pallidus (internal segment), which generally inhibits thalamic activity.\n   - Conversely, there is decreased activity in the lateral globus pallidus (external segment), which is involved in regulating the inhibitory output to the subthalamic nucleus.\n\n3. **Analyzing the Options**:\n   - **Option A**: Increased dopaminergic striatal neuron activity directed to the medial pallidum does not align with the disease mechanism, as there is decreased dopaminergic activity.\n   - **Option B**: Differential loss of activity of dopaminergic striatal neurons projecting to the pallidum directly relates to the observed changes in activity within the globus pallidus due to the loss So, the answer is (B)."}
{"number": 107, "chunk_path": "_/Allan_H_chunks_4000.json:chunk_107", "question": "A 70-year-old male presents with a resting tremor, rigidity, and bradykinesia. Neurological examination reveals difficulty initiating movements and a stooped posture. Which of the following best describes the underlying pathophysiology associated with his condition?", "options": {"A": "Reduced dopamine input from the substantia nigra to the striatum, leading to increased inhibitory drive on thalamic nuclei.", "B": "Increased excitatory input to the thalamus from the subthalamic nucleus due to overactivity of the indirect pathway.", "C": "Increased GABAergic activity in the striatum resulting in excessive motor inhibition.", "D": "Decreased glutamate signaling in the cortex leading to diminished motor output.", "E": "Elevated dopamine levels in the striatum causing hyperkinetic movements."}, "answer": "A", "chain_of_thought": "The patient in the question is a 70-year-old male presenting with classic symptoms of Parkinson's disease, which include resting tremor, rigidity, bradykinesia, difficulty initiating movements, and a stooped posture. \n\nIn Parkinson's disease, the underlying pathophysiology is characterized by a loss of dopamine-producing neurons in the substantia nigra, which is part of the basal ganglia. This loss leads to decreased dopamine input to the striatum. The striatum normally receives excitatory input from the cortex and inhibitory input from the substantia nigra. When dopamine levels are reduced, there is an increase in the inhibitory activity on thalamic nuclei, which results in reduced motor output and contributes to the symptoms of Parkinson's disease.\n\nNow, let's analyze the answer options:\n\nA) Reduced dopamine input from the substantia nigra to the striatum, leading to increased inhibitory drive on thalamic nuclei. - This option accurately describes the pathophysiology of Parkinson's disease.\n\nB) Increased excitatory input to the thalamus from the subthalamic nucleus due to overactivity of the indirect pathway. - This is not correct as the direct pathway is underactive due to lack of dopamine.\n\nC) Increased GABAergic activity in the striatum resulting in excessive motor inhibition. - While there may be increased GABA activity, the primary issue is the reduced dopamine.\n\nD) Decreased glutamate signaling in the cortex leading to diminished motor output So, the answer is (A)."}
{"number": 108, "chunk_path": "_/Allan_H_chunks_4000.json:chunk_108", "question": "A 72-year-old male with Parkinson disease presents with increased involuntary movements and dyskinesia after recent dose adjustments of his dopaminergic medication. Which neurotransmitter's activity is primarily affected in this patient's condition?", "options": {"A": "Serotonin", "B": "Acetylcholine", "C": "Dopamine", "D": "GABA", "E": "Glutamate"}, "answer": "C", "chain_of_thought": "To solve this question, we need to analyze the information provided about the 72-year-old male with Parkinson's disease. \n\n1. **Understanding Parkinson's Disease**: Parkinson's disease is a neurodegenerative disorder primarily characterized by the degeneration of dopaminergic neurons in the substantia nigra, leading to a deficiency of dopamine in the brain.\n\n2. **Symptoms and Medication**: The patient is experiencing increased involuntary movements and dyskinesia, which are side effects commonly associated with dopaminergic medications. Dyskinesia typically occurs when there is an overactivity of dopamine due to medication adjustments.\n\n3. **Identifying the Affected Neurotransmitter**: Since Parkinson's disease is associated with a deficiency of dopamine, and the patient's condition has worsened after dose adjustments of dopaminergic medication, it indicates that the primary neurotransmitter involved in the pathology and treatment of Parkinson's disease is dopamine.\n\nNow, we can evaluate the options provided:\n\n- A) Serotonin: Not primarily involved in Parkinson's disease.\n- B) Acetylcholine: While there is an imbalance between acetylcholine and dopamine in Parkinson's disease, it is not the primary neurotransmitter affected in this scenario.\n- C) Dopamine: This is the neurotransmitter that is deficient in Parkinson's disease and is directly related to the patient's symptoms and medication adjustments.\n- D) GABA: Not primarily involved in Parkinson's disease.\n- E) Glutamate: Not primarily involved in Parkinson So, the answer is (C)."}
{"number": 109, "chunk_path": "_/Allan_H_chunks_4000.json:chunk_109", "question": "A 60-year-old woman presents with a resting tremor, rigidity, and bradykinesia. Upon evaluation, the physician explains that the primary neurotransmitter involved in her condition is produced in the substantia nigra pars compacta and profoundly affects basal ganglia function. Which neurotransmitter is primarily implicated in this disorder?", "options": {"A": "Serotonin", "B": "Norepinephrine", "C": "Glutamate", "D": "Dopamine", "E": "Acetylcholine"}, "answer": "D", "chain_of_thought": "To solve this question, we need to analyze the symptoms and the information provided. \n\n1. The patient is a 60-year-old woman with symptoms of resting tremor, rigidity, and bradykinesia. These symptoms are characteristic of Parkinson's disease, which is a neurodegenerative disorder.\n\n2. The question mentions that the primary neurotransmitter involved in her condition is produced in the substantia nigra pars compacta. This is important because the substantia nigra is known to be involved in the production of dopamine.\n\n3. In Parkinson's disease, there is a significant loss of dopaminergic neurons in the substantia nigra, leading to decreased levels of dopamine. This deficiency in dopamine profoundly affects the function of the basal ganglia, which is crucial for coordinating movement.\n\n4. Now, let's evaluate the options given:\n   - A) Serotonin: Primarily involved in mood regulation, not directly in Parkinson's.\n   - B) Norepinephrine: Involved in arousal and alertness, not primarily related to motor control in this context.\n   - C) Glutamate: The main excitatory neurotransmitter, but not the primary one affected in Parkinson's.\n   - D) Dopamine: The neurotransmitter that is critically involved in Parkinson's disease and is produced in the substantia nigra.\n   - E) Acetylcholine: While it plays a role in motor control, it is not the primary neurotransmitter implicated in this particular So, the answer is (D)."}
{"number": 110, "chunk_path": "_/Allan_H_chunks_4000.json:chunk_110", "question": "Which of the following statements best describes the mechanism of action for L-dopa in the treatment of Parkinson disease?", "options": {"A": "L-dopa directly stimulates D2 receptors to increase motor activity.", "B": "L-dopa acts as an antagonist to glutamate for rapid symptom relief.", "C": "L-dopa crosses the blood-brain barrier and is converted to dopamine, increasing its concentration in the brain.", "D": "L-dopa enhances the activity of GABA to improve motor coordination.", "E": "L-dopa inhibits the synthesis of dopamine, reducing the symptoms of Parkinson disease."}, "answer": "C", "chain_of_thought": "To solve the question about the mechanism of action for L-dopa in the treatment of Parkinson's disease, let's first summarize the relevant information about L-dopa:\n\n1. **L-dopa (levodopa)** is a precursor to dopamine and is primarily used in the treatment of Parkinson's disease, where there is a deficiency of dopamine in the brain.\n2. **Parkinson's disease** is characterized by motor symptoms such as tremors, stiffness, and bradykinesia (slowness of movement), which are due to the loss of dopaminergic neurons in a part of the brain called the substantia nigra.\n3. **Mechanism of action**: L-dopa is able to cross the blood-brain barrier (which many substances cannot) and is then converted into dopamine within the brain, where it helps to replenish the reduced levels of dopamine, thus alleviating the motor symptoms of Parkinson's disease.\n\nNow, let's analyze the options given in the question:\n\nA) L-dopa directly stimulates D2 receptors to increase motor activity.  \n- This is incorrect because L-dopa does not directly stimulate receptors; it increases dopamine levels which may then stimulate the receptors.\n\nB) L-dopa acts as an antagonist to glutamate for rapid symptom relief.  \n- This is incorrect; L-dopa does not act as an antagonist to glutamate. Its primary action is related to dopamine.\n\nC) L-dopa crosses the blood-brain barrier and is converted to dopamine, So, the answer is (C)."}
{"number": 111, "chunk_path": "_/Allan_H_chunks_4000.json:chunk_111", "question": "Which medication is primarily used to treat the symptoms of Parkinson disease due to its ability to cross the blood-brain barrier?", "options": {"A": "Dopamine", "B": "L-dopa", "C": "Carbidopa", "D": "Bromocriptine", "E": "Benserazide"}, "answer": "B", "chain_of_thought": "To solve the question, we need to identify which medication is primarily used to treat the symptoms of Parkinson's disease and has the ability to cross the blood-brain barrier.\n\n1. **Parkinson's Disease Overview**: Parkinson's disease is a neurodegenerative disorder characterized by the loss of dopamine-producing neurons in the brain. This leads to symptoms such as tremors, rigidity, and bradykinesia (slowness of movement).\n\n2. **Dopamine**: While dopamine itself is a neurotransmitter that is deficient in Parkinson's disease, it does not cross the blood-brain barrier when administered as a medication.\n\n3. **L-dopa (Levodopa)**: L-dopa is a precursor to dopamine and can cross the blood-brain barrier. Once in the brain, it is converted to dopamine, which helps alleviate the symptoms of Parkinson's disease. This is the primary treatment for Parkinson's.\n\n4. **Carbidopa**: Carbidopa is not a treatment by itself but is usually combined with L-dopa to prevent L-dopa from being converted to dopamine outside of the brain (peripherally), which helps in reducing side effects and increasing the effectiveness of L-dopa.\n\n5. **Bromocriptine**: Bromocriptine is a dopamine agonist that mimics the effects of dopamine in the brain but is not the primary treatment as L-dopa is.\n\n6. **Benserazide**: Benserazide is So, the answer is (B)."}
{"number": 113, "chunk_path": "_/Allan_H_chunks_4000.json:chunk_113", "question": "A 70-year-old man presents with a tremor, rigid posture, and increased salivation. He has difficulty initiating movements and displays a monotonic speech pattern. Which of the following describes the primary motor symptoms of this patient?", "options": {"A": "Hyperkinesia and myoclonus", "B": "Dystonia and dyskinesia", "C": "Hypokinesia and bradykinesia", "D": "Chorea and athetosis", "E": "Cerebellar incoordination"}, "answer": "C", "chain_of_thought": "To solve this question, we need to analyze the symptoms presented by the 70-year-old man. The key symptoms include:\n\n- Tremor\n- Rigid posture\n- Increased salivation\n- Difficulty initiating movements\n- Monotonic speech pattern\n\nThese symptoms are characteristic of Parkinson's disease, which primarily involves issues with motor control. \n\nNow, let's break down the options provided:\n\nA) Hyperkinesia and myoclonus - Hyperkinesia refers to increased movement, while myoclonus refers to sudden muscle jerks. These do not fit the symptoms described.\n\nB) Dystonia and dyskinesia - Dystonia involves sustained muscle contractions, and dyskinesia refers to involuntary movements. Again, this does not match the primary symptoms noted.\n\nC) Hypokinesia and bradykinesia - Hypokinesia refers to reduced movement, and bradykinesia refers to slowness of movement. These terms align well with the patient's difficulty in initiating movements and the rigidity.\n\nD) Chorea and athetosis - Chorea involves irregular, rapid movements, and athetosis involves slow, writhing movements. These do not fit the symptom profile of this patient.\n\nE) Cerebellar incoordination - This typically involves problems with balance and coordination rather than the specific symptoms described.\n\nGiven that the patient exhibits signs of reduced movement and slowness, the most fitting description of his primary motor symptoms is hyp So, the answer is (C)."}
{"number": 114, "chunk_path": "_/Allan_H_chunks_4000.json:chunk_114", "question": "A 72-year-old man presents to the clinic with complaints of difficulty initiating movements and a masked facial expression. He has noticed that he is slower in getting out of chairs and has begun to drool. On examination, his speech is rapid and monotonic, and he exhibits bradykinesia. Which of the following describes the underlying pathophysiological cause of his symptoms?", "options": {"A": "Decreased serotonergic input from the raphe nuclei", "B": "Reduced dopaminergic input from the substantia nigra to the striatum", "C": "Increased cholinergic activity in the basal ganglia", "D": "Neurotransmitter imbalance in the frontal cortex", "E": "Increased glutamatergic activity in the thalamus"}, "answer": "B", "chain_of_thought": "To solve the question, we need to analyze the symptoms of the 72-year-old man presented in the scenario. \n\n1. **Symptoms Analysis**: The man exhibits difficulty initiating movements (a hallmark of bradykinesia), a masked facial expression (which suggests a lack of facial movement, often seen in Parkinson's disease), slowness in getting out of chairs, drooling, rapid and monotonic speech, and bradykinesia. These signs are highly indicative of Parkinson's disease, which is characterized by the degeneration of dopaminergic neurons.\n\n2. **Pathophysiological Cause**: In Parkinson's disease, there is a significant loss of dopaminergic neurons in the substantia nigra, which leads to reduced dopamine levels in the striatum (part of the basal ganglia). This dopamine deficiency causes the motor symptoms observed, such as bradykinesia, rigidity, and postural instability.\n\n3. **Options Evaluation**: \n   - A) Decreased serotonergic input from the raphe nuclei - This is not primarily related to the symptoms described.\n   - B) Reduced dopaminergic input from the substantia nigra to the striatum - This matches the pathophysiology of Parkinson's disease.\n   - C) Increased cholinergic activity in the basal ganglia - This occurs secondary to the loss of dopaminergic activity, but is not the primary cause.\n   - D) Neurotransmitter imbalance in the frontal So, the answer is (B)."}
{"number": 116, "chunk_path": "_/Allan_H_chunks_4000.json:chunk_116", "question": "A 65-year-old male presents with resting tremors, rigidity, and bradykinesia. His spouse notes that he has had difficulty with movement and stiffness for the last year. Which condition is characterized by these symptoms and typically involves a variable degree of muscle rigidity?", "options": {"A": "Wilson disease", "B": "Parkinson disease", "C": "Huntington chorea", "D": "Dystonia musculorum deformans", "E": "Cerebral palsy"}, "answer": "B", "chain_of_thought": "To solve this question, we need to analyze the symptoms presented and match them with the conditions listed in the options.\n\n1. **Symptoms Analysis**: The patient is a 65-year-old male with the following symptoms:\n   - Resting tremors\n   - Rigidity\n   - Bradykinesia (slowness of movement)\n   - Difficulty with movement and stiffness for the last year\n\n2. **Conditions Analysis**:\n   - **A) Wilson disease**: This is a genetic disorder that leads to copper accumulation in the body, which can cause neurological symptoms, but it typically does not present primarily with resting tremors and rigidity.\n   - **B) Parkinson disease**: This condition is characterized by resting tremors, rigidity (muscle stiffness), and bradykinesia. It commonly affects elderly individuals and matches the symptoms described.\n   - **C) Huntington chorea**: This is a genetic disorder that causes progressive motor dysfunction and cognitive decline, but it typically presents with chorea (involuntary movements) rather than resting tremors and rigidity.\n   - **D) Dystonia musculorum deformans**: This condition involves sustained muscle contractions and abnormal postures but is not primarily characterized by resting tremors and rigidity.\n   - **E) Cerebral palsy**: This is a group of disorders affecting movement and posture, typically due to brain injury before or during birth, and does not specifically match the symptoms described.\n\n3. **Conclusion** So, the answer is (B)."}
{"number": 117, "chunk_path": "_/Allan_H_chunks_4000.json:chunk_117", "question": "A 60-year-old man presents with progressive rigidity and bradykinesia. He has a family history of Parkinson's disease and is currently on no medications. Neurological examination reveals a classic 'cogwheel' rigidity in his arms and a resting tremor. Which of the following statements is most accurate regarding the underlying pathophysiology of his condition?", "options": {"A": "Rigidity is due to lesions of the basal ganglia circuit involving dopamine deficiency.", "B": "Rigidity is primarily a result of structural defects in the frontal lobes.", "C": "Rigidity is caused by excessive activation of the thalamocortical pathways.", "D": "Rigidity is solely attributed to the degeneration of the spinal cord motor neurons.", "E": "Rigidity results from the direct stimulation of the motor cortex."}, "answer": "A", "chain_of_thought": "To solve the question, we first summarize the key information provided:\n\n- The patient is a 60-year-old man with progressive rigidity and bradykinesia.\n- He has a family history of Parkinson's disease, indicating a potential genetic predisposition.\n- Neurological examination reveals cogwheel rigidity and a resting tremor, which are classic signs of Parkinson's disease.\n\nNow, let's analyze the options provided:\n\nA) Rigidity is due to lesions of the basal ganglia circuit involving dopamine deficiency.\n- This statement accurately reflects the pathophysiology of Parkinson's disease. In Parkinson's, there is degeneration of dopaminergic neurons in the substantia nigra, leading to a deficiency in dopamine that affects the basal ganglia circuitry, resulting in rigidity and other motor symptoms.\n\nB) Rigidity is primarily a result of structural defects in the frontal lobes.\n- This is incorrect as Parkinson's disease primarily involves the basal ganglia, not the frontal lobes.\n\nC) Rigidity is caused by excessive activation of the thalamocortical pathways.\n- This is misleading. While there is altered thalamocortical activity in Parkinson's, rigidity is not primarily caused by excessive activation of these pathways.\n\nD) Rigidity is solely attributed to the degeneration of the spinal cord motor neurons.\n- This is incorrect. Parkinson's disease is characterized by basal ganglia dysfunction, not spinal cord motor neuron degeneration.\n\nE) Rigidity results from the direct stimulation of the motor cortex.\n- This is So, the answer is (A)."}
{"number": 118, "chunk_path": "_/Allan_H_chunks_4000.json:chunk_118", "question": "Which of the following diseases is characterized by chorea as a major feature?", "options": {"A": "Wilson disease", "B": "Alzheimer's disease", "C": "Huntington disease", "D": "Multiple sclerosis", "E": "Parkinson's disease"}, "answer": "C", "chain_of_thought": "To determine which disease is characterized by chorea as a major feature, we need to understand what chorea is and which of the listed diseases are associated with it.\n\nChorea is a movement disorder that is characterized by irregular, non-repetitive, and rapid movements. It is often associated with neurological conditions.\n\nNow, let's briefly review the options provided:\n\nA) Wilson disease - This is a genetic disorder that leads to excessive copper accumulation in the body, primarily affecting the liver and brain. While it can cause movement disorders, chorea is not its primary feature.\n\nB) Alzheimer's disease - This is a neurodegenerative disease primarily affecting memory and cognitive function. Chorea is not a characteristic feature of Alzheimer's.\n\nC) Huntington disease - This is a genetic disorder that specifically causes chorea as one of its hallmark symptoms. It is a progressive neurodegenerative disease that leads to movement disorders, cognitive decline, and psychiatric symptoms.\n\nD) Multiple sclerosis - This is an autoimmune disease affecting the central nervous system, leading to a variety of symptoms, but chorea is not a typical feature.\n\nE) Parkinson's disease - This is a movement disorder characterized by tremors, rigidity, and bradykinesia, but not chorea.\n\nFrom this analysis, it is clear that Huntington disease is the only option that is primarily characterized by chorea.\n\nSo, the answer is (C) Huntington disease."}
{"number": 120, "chunk_path": "_/Allan_H_chunks_4000.json:chunk_120", "question": "In a 25-year-old woman presenting with sudden onset of unilateral chorea after starting oral contraceptives, what is the most likely underlying condition?", "options": {"A": "Hyperthyroidism", "B": "Systemic lupus erythematosus", "C": "Huntington disease", "D": "AIDS", "E": "Polycythemia vera"}, "answer": "B", "chain_of_thought": "To solve the question, let's analyze the information provided:\n\n1. **Patient Profile**: The patient is a 25-year-old woman.\n2. **Symptom Presentation**: She has sudden onset of unilateral chorea. Chorea refers to involuntary, irregular movements that can be caused by various neurological and systemic conditions.\n3. **Recent Change**: The symptom appeared after starting oral contraceptives, which suggests a possible link between the medication and the onset of chorea.\n\nNow, let's evaluate the answer options based on the potential underlying conditions related to chorea:\n\nA) **Hyperthyroidism**: While hyperthyroidism can lead to various neurological symptoms, it is not commonly associated with sudden unilateral chorea.\n\nB) **Systemic lupus erythematosus (SLE)**: SLE can cause neurological symptoms, including chorea, particularly in young women. There is a known association between SLE and chorea, and it can be exacerbated by hormonal changes, such as those induced by oral contraceptives.\n\nC) **Huntington disease**: Huntington's is a genetic disorder that causes chorea, but it typically presents with a family history and symptoms in mid-adulthood rather than suddenly in a 25-year-old without prior symptoms.\n\nD) **AIDS**: Although AIDS can lead to various neurological complications, it is less commonly linked to sudden unilateral chorea in a young woman.\n\nE) **Polycythemia vera**: This condition So, the answer is (B)."}
{"number": 122, "chunk_path": "_/Allan_H_chunks_4000.json:chunk_122", "question": "A 35-year-old man presents with uncontrollable, poorly patterned flinging movements of his right arm after suffering a stroke affecting the right subthalamic nucleus. What is the most likely diagnosis he's experiencing?", "options": {"A": "Athetosis", "B": "Chorea", "C": "Ballismus", "D": "Dystonia", "E": "Tremor"}, "answer": "C", "chain_of_thought": "To solve the question, we start by understanding the symptoms and context provided.\n\n1. **Patient Profile**: The patient is a 35-year-old man.\n2. **Symptoms**: He has uncontrollable, poorly patterned flinging movements of his right arm.\n3. **Medical History**: He suffered a stroke affecting the right subthalamic nucleus.\n\nNext, let's analyze the condition based on the provided options:\n\n- **A) Athetosis**: This refers to slow, writhing movements that are usually more continuous and less flinging in nature than what is described.\n- **B) Chorea**: This is characterized by irregular, unpredictable, and non-repetitive movements. However, it doesn't usually describe the flinging motion as specifically as the question suggests.\n- **C) Ballismus**: This condition is characterized by violent, flinging movements, particularly of the limbs. It is commonly associated with damage to the subthalamic nucleus.\n- **D) Dystonia**: This involves sustained muscle contractions, leading to twisting and repetitive movements or abnormal postures, which do not match the described flinging movements.\n- **E) Tremor**: This is typically rhythmic and oscillatory and does not align with the description of \"flinging\" movements.\n\nConsidering the information and the nature of the movements described, the most appropriate diagnosis for the man, particularly given the involvement of the subthalamic nucleus and the type of movements, is ball So, the answer is (C)."}
{"number": 123, "chunk_path": "_/Allan_H_chunks_4000.json:chunk_123", "question": "Which of the following conditions is most commonly associated with the development of dystonia?", "options": {"A": "Wilson disease", "B": "Diabetes mellitus", "C": "Hypertension", "D": "Asthma", "E": "Osteoporosis"}, "answer": "A", "chain_of_thought": "To solve this question, we need to analyze each option in relation to dystonia, which is a movement disorder characterized by sustained muscle contractions, abnormal postures, or twisting movements. We will consider which of the conditions listed is most commonly associated with the development of dystonia.\n\n1. **Wilson disease (A)**: This is a genetic disorder that leads to excessive copper accumulation in the body, affecting the liver and brain. Neurological symptoms, including dystonia, can develop due to copper buildup in the basal ganglia. Wilson's disease is well-known for causing movement disorders.\n\n2. **Diabetes mellitus (B)**: While diabetes can lead to various complications, it is not commonly associated with the development of dystonia. It primarily affects metabolic processes and can lead to neuropathy but not specifically dystonia.\n\n3. **Hypertension (C)**: High blood pressure itself does not have a direct association with dystonia. It is a cardiovascular condition and is not known to cause movement disorders.\n\n4. **Asthma (D)**: Asthma is a respiratory condition characterized by airway inflammation and is not linked to movement disorders like dystonia.\n\n5. **Osteoporosis (E)**: This condition involves a decrease in bone density and is related to skeletal health, not to movement disorders.\n\nGiven this analysis, Wilson disease is the only condition from the list that is specifically associated with the development of dystonia due to its neurological effects.\n\nSo, the answer is (A) Wilson disease."}
{"number": 124, "chunk_path": "_/Allan_H_chunks_4000.json:chunk_124", "question": "A 34-year-old male presents with an involuntary, twisting movement of his neck and shoulder. He reports that the movements worsen with stress and improve when he is relaxed. Which of the following conditions is most likely associated with his symptoms?", "options": {"A": "Parkinson disease", "B": "Rapid-onset dystonia-parkinsonism", "C": "Spasmodic torticollis", "D": "Acquired hepatocerebral degeneration", "E": "Wilson disease"}, "answer": "C", "chain_of_thought": "To solve the question, we need to analyze the symptoms presented by the 34-year-old male: involuntary, twisting movements of the neck and shoulder that worsen with stress and improve when relaxed. \n\n1. **Understanding the symptoms**: The patient experiences involuntary movements that are specific to the neck and shoulder area, which suggests a movement disorder. The fact that the movements worsen with stress and improve when relaxed indicates that they may be related to a form of dystonia.\n\n2. **Evaluating the options**:\n   - **A) Parkinson disease**: This is primarily characterized by resting tremors, bradykinesia, and rigidity, rather than specific twisting movements of the neck and shoulder. It's less likely.\n   - **B) Rapid-onset dystonia-parkinsonism**: This condition is characterized by sudden onset of dystonic movements and parkinsonism features. However, it's less common and usually presents with more generalized symptoms.\n   - **C) Spasmodic torticollis**: This is a form of focal dystonia that specifically affects the neck muscles, leading to involuntary twisting and turning of the head. The symptoms can worsen with stress and improve with relaxation, which aligns well with the patient's description.\n   - **D) Acquired hepatocerebral degeneration**: This condition is associated with liver disease and can lead to neurological symptoms, but it does not specifically match the description of involuntary twisting movements in the neck and shoulder.\n   - So, the answer is (C)."}
{"number": 125, "chunk_path": "_/Allan_H_chunks_4000.json:chunk_125", "question": "A 24-year-old male presents to the emergency department with rapid onset severe dystonic spasms, dysarthria, and dysphagia following a febrile illness. Which condition is most likely responsible for these symptoms?", "options": {"A": "Acute generalized dystonia due to neuroleptic use", "B": "Rapid-onset dystonia-parkinsonism", "C": "Tardive dyskinesia from long-term medication", "D": "Post-stroke hemidystonia", "E": "Primary blepharospasm"}, "answer": "B", "chain_of_thought": "To address the question, we need to analyze the symptoms and the context given. The patient is a 24-year-old male who has experienced rapid-onset severe dystonic spasms, dysarthria (difficulty speaking), and dysphagia (difficulty swallowing) following a febrile illness. \n\n1. **Rapid onset**: The symptoms developed quickly after a febrile illness, indicating an acute process rather than a chronic one.\n2. **Dystonia**: This refers to sustained muscle contractions, abnormal postures, or repetitive movements, which aligns with the dystonic spasms the patient is experiencing.\n3. **Dysarthria and dysphagia**: These symptoms suggest involvement of the muscles that control speech and swallowing, which can occur with neurological conditions affecting motor control.\n\nNow, let's evaluate the options:\n\nA) **Acute generalized dystonia due to neuroleptic use**: This typically occurs after exposure to neuroleptic medications, which is not mentioned in this case. The rapid onset after a febrile illness does not strongly suggest this.\n\nB) **Rapid-onset dystonia-parkinsonism**: This condition can present with rapid onset dystonia and can be triggered by infections or other stressors, making it a strong candidate.\n\nC) **Tardive dyskinesia from long-term medication**: This condition results from long-term use of antipsychotic medications and would not align with the acute presentation after a febrile illness. So, the answer is (B)."}
{"number": 126, "chunk_path": "_/Allan_H_chunks_4000.json:chunk_126", "question": "Which of the following treatments is considered the most effective for focal dystonias?", "options": {"A": "Anticonvulsant medications like phenytoin", "B": "Periodic injection of botulinum toxin into affected muscles", "C": "Stereotactic surgery on the ventrolateral thalamus", "D": "Benzodiazepines such as clonazepam", "E": "Trihexyphenidyl (Artane) in massive doses"}, "answer": "B", "chain_of_thought": "To solve the question regarding the most effective treatment for focal dystonias, we need to evaluate the options based on current medical knowledge regarding treatment effectiveness for this condition.\n\n1. **Anticonvulsant medications like phenytoin (Option A)**: While anticonvulsants can be used for some neurological conditions, they are not typically the first-line treatment for focal dystonias.\n\n2. **Periodic injection of botulinum toxin into affected muscles (Option B)**: Botulinum toxin injections are widely recognized as a highly effective treatment for focal dystonias. They help to reduce muscle spasms and improve function in the affected areas.\n\n3. **Stereotactic surgery on the ventrolateral thalamus (Option C)**: This surgical option is more invasive and is usually reserved for cases that do not respond to less invasive treatments. It can be effective, but it is not considered the first-line or most effective treatment.\n\n4. **Benzodiazepines such as clonazepam (Option D)**: Benzodiazepines may help with some muscle relaxation, but they are not specific treatments for focal dystonias and are generally not the most effective option.\n\n5. **Trihexyphenidyl (Artane) in massive doses (Option E)**: This anticholinergic medication can be used for dystonic movements, but it is not as effective as botulinum toxin injections and can have significant side effects, especially in higher doses.\n\nAfter So, the answer is (B)."}
{"number": 127, "chunk_path": "_/Allan_H_chunks_4000.json:chunk_127", "question": "Which type of involuntary movement is characterized by rapid, discrete movements and can occur alongside slower, confluently appearing movements in conditions such as choreoathetosis?", "options": {"A": "Ballismus", "B": "Dystonia", "C": "Chorea", "D": "Athetosis", "E": "Hemiballismus"}, "answer": "C", "chain_of_thought": "To solve the question, we need to analyze the types of involuntary movements mentioned in the options and relate them to the characteristics described in the question.\n\n1. **Understanding the question**: The question describes involuntary movements that are rapid and discrete, and can occur alongside slower movements. It specifically mentions \"choreoathetosis,\" which is a combination of chorea (rapid movements) and athetosis (slow, writhing movements).\n\n2. **Analyzing the options**:\n   - **A) Ballismus**: This is characterized by large, flinging movements, often of the limbs. It does not fit the description of rapid, discrete movements alongside slower movements.\n   - **B) Dystonia**: This involves sustained muscle contractions and abnormal postures, which are not described as rapid or discrete.\n   - **C) Chorea**: This fits the description well. Chorea consists of rapid, irregular, and unintentional movements. It can occur with slower movements seen in athetosis.\n   - **D) Athetosis**: This involves slow, writhing movements and does not fit the \"rapid, discrete\" description.\n   - **E) Hemiballismus**: This is similar to ballismus but is typically limited to one side of the body. While it involves rapid movements, it is not characterized by discrete movements alongside slower ones.\n\n3. **Conclusion**: Based on the definitions and characteristics of the movements, the So, the answer is (C)."}
